registration_no,subject_content_text,dbscan_cluster
MORLY/E/2023/7890123,"Station par ek lift kharab hai, bahut mushkil hoti hai chadhne mein.",0
MORLY/E/2023/8901235,Train ki timing samasya kab suljhaegi? Bahut dikkat ho rahi hai.,0
MORLY/E/2023/1234567,Mujhe payment receive nahi hua. Please madad karein.,0
MORLY/E/2023/7890124,"Mujhe staff se bahut problem hui, unse baat karni mujhe pasand nahi hai.",0
MORLY/E/2023/3456780,"Station ke bahar badi gandi hai, bahut dikkat hoti hai, please clean karein.",-1
MORLY/E/2023/5678903,"Train ki frequency bahut kam hai, kya aap isko badha sakte hain?",0
MORLY/E/2023/6789012,"Mera payment ab tak nahi aaya hai, please jaldi karein.",0
MORLY/E/2023/7890125,"Staff se koi madad nahi mil rahi, sab log busy hain.",0
MORLY/E/2023/8901237,"Jodhpur station par platform bahut kharab hai, sudhar karein.",0
MORLY/E/2023/3456781,"Train ka performance accha nahi hai, thoda behtar kariye.",-1
MORLY/E/2023/2345678,"Platform pe safai nahi hoti hai, bhut ganda lagta hai.",0
MORLY/E/2023/3456789,"Mera ticket ka paisa refund nahi hua hai, please help.",0
MORLY/E/2023/4567890,"Train timing sahi nahi hai, delay hota hai baar baar.",0
MORLY/E/2023/5678901,"Staff ka behavior acha nahi hai, rude bolte hain.",0
MORLY/E/2023/6789012,"Station ki building dikkat de rahi hai, kuch karna padega.",0
MORLY/E/2023/7890123,Mere account se paise ghote hain bina kisi reason ke.,0
MORLY/E/2023/8901234,Trains baar baar cancel ho rahi hain. Kya hota hai?,0
MORLY/E/2023/9012345,"Train mein staff ka behavior samasya hai, unse baat nahi hoti.",0
MORLY/E/2023/0123456,"Railway stations par basic facilities nahi hain, bahut mushkil hota hai.",0
MORLY/E/2023/1234567,"Ticket booking mein payment issue aa raha hai, please help.",0
MORLY/E/2023/2345679,"Train ka schedule kabhi kabhi sahi nahi hota, kuch karna padega.",0
MORLY/E/2023/3456780,"Train staff kabhi kabhi samasya dete hain, unhe sudharna padega.",-1
MORLY/E/2023/4567891,"Station ki cleanliness bahut kharab hai, kuch nahi hota yahan.",0
MORLY/E/2023/5678902,"Mera refund nahi aa raha, kya problem hai?",0
MORLY/E/2023/6789013,"Train ke operation mein kai baar dikkat hoti hai, kuch nahi hota.",0
MORLY/E/2023/7890124,"Railway staff ka behavior theek nahi hai, sudhar karna padega.",0
MORLY/E/2023/8901235,"Station ki infrastructure bahut purani hai, badalna padega.",0
MORLY/E/2023/9012346,"Refund ka process kuch samasya dikha raha hai, please assist.",0
MORLY/E/2023/0123457,"Train ka delay baar baar hota hai, bhut parishani hoti hai.",0
MORLY/E/2023/1234568,"Staff ka behavior acha nahi hai, kuch karna padega.",0
MORLY/E/2023/2345670,"Station par facilities bilkul nahi hain, zaroori hai sudharna.",0
MORLY/E/2023/3456781,"Mera payment ab tak nahi aaya, kya issue hai?",0
MORLY/E/2023/1234567,"Mujhe train ka time change hone ki information nahi mili, is wajah se problem hui.",0
MORLY/E/2023/2345678,"Mujhe ticket ke liye ki gayi payment ka confirmation nahi mila, bahut pareshaan hoon.",0
MORLY/E/2023/3456789,"Platform par safai nahi ho rahi hai, bahut ganda ho gaya hai.",0
MORLY/E/2023/4567890,"Railway ke staff ne mujhe bura bhala kaha, unki training nahi hui kya?",-1
MORLY/E/2023/5678901,"Train mein kaafi der ho gayi, koi information nahi di gayi.",0
MORLY/E/2023/6789012,"Mainne ticket cancel kiya tha par refund nahi mila, samasya hai.",0
MORLY/E/2023/7890123,"Station ke washroom bahut gande hain, safai nahi ho rahi hai.",0
MORLY/E/2023/8901234,"Railway personnel ne mujhe rude behavior dikhaya, bahut bura laga.",0
MORLY/E/2023/9012345,"Train ki timing barabar nahi hai, bar bar der hoti hai.",0
MORLY/E/2023/0123456,"Maine dus baar payment kiya par ticket nahi mila, kya karun?",0
MORLY/E/2023/1234568,"Station par lift kaam nahi kar raha, bahut dikkat ho rahi hai.",0
MORLY/E/2023/2345679,"Staff ne meri madad nahi ki jab mujhe zarurat thi, bahut naraz hoon.",0
MORLY/E/2023/3456780,"Train mein khana nahi tha aur bahut der ho gayi, sab kuch khatam ho gaya.",0
MORLY/E/2023/4567891,"Mainne ticket book kiya tha par amount nahi deduct hua, kya problem hai?",0
MORLY/E/2023/5678902,"Station par parking facility nahi hai, bahut pareshaani ho rahi hai.",0
MORLY/E/2023/6789013,"Mujhe railway staff se madad nahi mili jab mujhe zaroorat thi, bhut bura laga.",0
MORLY/E/2023/7890124,"Train ka schedule barabar nahi hai, baar baar der hoti hai.",0
MORLY/E/2023/8901235,"Mujhe refund nahi mila, ticket cancel kiya tha, samasya hai.",0
MORLY/E/2023/9012346,"Railway station ke aas paas gande paani ka problem hai, bahut takleef ho rahi hai.",0
MORLY/E/2023/6543210,"Train ki timing kabhi sahi nahi hoti hai, iski wajah se main hamesha late hota hoon.",0
MORLY/E/2023/7654321,"Mera ticket ka paisa wapas nahi ho raha hai, please madad karein.",0
MORLY/E/2023/8765432,"Station ka infrastructure bahut kharab hai, please dekhiye.",0
MORLY/E/2023/9876543,"Staff ki service behad kharab hai, mujhe madad chahiye.",0
MORLY/E/2023/1597532,"Train ki service bilkul bhi sahi nahi hai, maine suna hai ki bahut delay hota hai.",0
MORLY/E/2023/3571598,"Mera refund nahi aaya hai, please jaldi karein.",0
MORLY/E/2023/7539510,"Platform pe bahut ghusara hai, kaam karo yaar.",0
MORLY/E/2023/1597534,"Train mein staff bahut rude hai, kya kuch ho sakta hai?",0
MORLY/E/2023/2468101,"Train ka schedule bahut kharab hai, bahut late hoti hai.",0
MORLY/E/2023/7890123,"Mere debit card se paisa kaat liya, par ticket nahi aaya.",0
MORLY/E/2023/2345678,"Railway station ki safai bahut kharab hai, kya aap kuch kar sakte hain?",0
MORLY/E/2023/3456789,"Railway staff ki training zaroori hai, theek se kaam nahi karte.",0
MORLY/E/2023/4567890,"Mujhe train ki timing se bahut dikkat hoti hai, sab time par nahi aati.",0
MORLY/E/2023/5678901,Mera ticket ka refund process nahi ho raha hai. Help karo.,0
MORLY/E/2023/6789012,"Bahut gande toilet hain station par, please dekhiye.",0
MORLY/E/2023/7890123,"Staff se achha behavior nahi hai, please samjhao unhe.",0
MORLY/E/2023/8901234,"Train bahut late hoti hai, kya aap kuch kar sakte hain?",0
MORLY/E/2023/9012345,"Mujhe ticket ka paisa nahi mila hai, please dekhiye.",0
MORLY/E/2023/0123456,"Platform bahut kharab hai, kaam toh karo.",0
MORLY/E/2023/1234567,Train ki timing bahut late ho gayi thi. Pichle 2 ghante se wait kar rahe hain.,0
MORLY/E/2023/2345678,"Maine ticket ke liye payment kiya tha, par confirmation nahi aaya. Account number: XXXXXX1234.",0
MORLY/E/2023/3456789,Station par staff ka behavior bahut behtar hona chahiye. Unhone mujhe rude way mein treat kiya.,0
MORLY/E/2023/4567890,Platform par bahut gande paani ka stagnation hai. Yeh passengers ke liye danger hai.,0
MORLY/E/2023/5678901,Mujhe train ka koi announcement nahi suna. Bahut confusion ho gaya tha.,0
MORLY/E/2023/6789012,"Mujhe refund nahi mila, jab maine cancellation kiya. Account no: XXXXXX6789.",0
MORLY/E/2023/7890123,Train staff ne mere saath bura vyavhaar kiya. Unhe training ki zarurat hai.,1
MORLY/E/2023/8901234,"Station par toilets kharab hain, use nahi kiya ja sakta.",-1
MORLY/E/2023/9012345,"Mujhe train ka seat nahi mila, jab maine booking ki. Bahut pareshani hui.",0
MORLY/E/2023/0123456,Maine ticket cancel kiya tha lekin refund nahi mila. Account no: XXXXXX4321.,0
MORLY/E/2023/1234501,Staff ka behavior bilkul theek nahi hai. Kripya inhe training deni chahiye.,0
MORLY/E/2023/2345602,"Platform ki safai bahut zaroori hai, kyunki bahut ganda hai.",0
MORLY/E/2023/3456703,"Train ka schedule baar-baar change ho raha hai, mujhe samajh nahi aata.",0
MORLY/E/2023/4567804,"Ticket booking ke baad payment nahi hua, bahut pareshani hui.",0
MORLY/E/2023/5678905,"Train staff ne accha vyavhaar nahi kiya, mujhe bura laga.",0
MORLY/E/2023/6789016,"Platform par gande paani ka stagnation hai, bahut dikkat ho rahi hai.",0
MORLY/E/2023/7890127,Mujhe train se jaana tha lekin train nahi aayi. Bahut pareshani hui.,0
MORLY/E/2023/8901238,"Maine online payment kiya, lekin confirmation nahi aaya. Account no: XXXXXX9876.",0
MORLY/E/2023/9012349,"Staff ka response kaafi bekar hai, unhe training ki zarurat hai.",0
MORLY/E/2023/0123470,"Platform ki safai bahut kharab hai, is par turant dhyan dena zaroori hai.",0
MORLY/E/2023/1234567,Train ka pahunchne ka time hamesha late hota hai. Is baar toh khud se baatein karne bhi aaye the.,0
MORLY/E/2023/2345678,Mujhe ticket refund nahi mila hai. Bahut samay ho gaya. Kya karun?,0
MORLY/E/2023/3456789,"Kuch staff ka behavior theek nahi hai, unse baat karne par wo rude ho rahe hain.",0
MORLY/E/2023/4567890,Station par facilities bahut kharab hain. Washroom aur waiting area bilkul clean nahi hain.,0
MORLY/E/2023/5678901,"Train ka schedule sabse bekar hai, koi samay pe nahi aata. Ispar dhyan diya jaye.",0
MORLY/E/2023/6789012,Mujhe online payment mein dikkat aa rahi hai. Kya aap madad kar sakte hain?,0
MORLY/E/2023/7890123,Kuch staff ko training ki zarurat hai. Unka behavior bahut kharab hai.,0
MORLY/E/2023/8901234,"Platform bahut kharab hai, paani bhara rehta hai. Yeh bahut hi gandi baat hai.",0
MORLY/E/2023/9012345,"Train ka time aur frequency dono hi badal dijiye, bahut dikkat hoti hai.",0
MORLY/E/2023/0123456,"Online payment process mein koi dikkat aa rahi hai, help karein.",0
MORLY/E/2023/1234568,"Train mein staff ka behavior accha nahi hai, please improve kariye.",0
MORLY/E/2023/2345679,"Railway stations par toilets bahut gande hain, isse sudharna chahiye.",0
MORLY/E/2023/3456780,"Train ka timing bahut problematic hai, please ispar dhyan dijiye.",0
MORLY/E/2023/4567891,Ticket refund ka process samajh nahi aa raha hai. Help karein.,0
MORLY/E/2023/5678902,"Staff ki training mein kami hai, unhe train karna zaroori hai.",0
MORLY/E/2023/6789013,"Station par safai nahi hoti hai, isse darshak ko dikkat hoti hai.",0
MORLY/E/2023/7890124,"Train ka schedule samay par nahi hai, yeh aasha se bahut behtar hona chahiye.",0
MORLY/E/2023/8901235,Mujhe ticket ke liye payment nahi mil raha hai. Please jaldi madad karein.,0
MORLY/E/2023/9012346,"Kuch staff ko training ki kami hai, is par dhyan dena zaroori hai.",0
MORLY/E/2023/0123457,Stations par gande washrooms aur facilities ka bahut dhyan nahi diya jata.,0
MORLY/E/2023/1234569,"Train ka punctuality bilkul nahi hai, yeh bahut bura hai.",0
MORLY/E/2023/2345670,"Refund process itna complicated hai, please isay asaan karo.",0
MORLY/E/2023/3456781,"Staff ki training bahut zaroori hai, unka behavior accha nahi hai.",0
MORLY/E/2023/1234567,"Train ka schedule bahut hi kharab hai. Time par nahi aati, logon ko pareshani hoti hai.",0
MORLY/E/2023/2345678,Mere ticket ka paisa refund nahi hua. Bahut samay ho gaya.,0
MORLY/E/2023/3456789,"Platform bahut dirty hai. Safai nahi hoti, yeh bahut bura lagta hai.",0
MORLY/E/2023/4567890,"Station par staff ki kami hai, kabhi kabhi madad nahi milti hai.",0
MORLY/E/2023/5678901,"Train time pe nahi chalti, bhai log pareshan hain.",0
MORLY/E/2023/6789012,"Mujhe mere ticket ka paisa nahi mila, please jaldi karein.",0
MORLY/E/2023/7890123,"Railway station par washroom bahut ganda hai, saaf nahi kiya jata.",0
MORLY/E/2023/8901234,"Staff kabhi kabhi rude hote hain, customer service better honi chahiye.",0
MORLY/E/2023/9012345,"Train late aati hai, ispar koi action nahi liya ja raha.",0
MORLY/E/2023/0123456,"Mujhe mere ticket ka paisa nahi mil raha, help karein.",0
MORLY/E/2023/1234568,"Station par koi seating arrangement nahi hai, yeh bahut bura hai.",0
MORLY/E/2023/2345679,"Kuch staff rude hote hain, isko improve karna chahiye.",0
MORLY/E/2023/3456780,"Train ka number pata nahi chala, koi madad nahi mil rahi hai.",0
MORLY/E/2023/4567891,"Mujhe mere refund ka paisa nahi mila, please jaldi karein.",0
MORLY/E/2023/5678902,"Station ka infrastructure bahut kharab hai, kuch nahi badla.",0
MORLY/E/2023/6789013,"Kuch railway staff rude hain, unhe sabko respect dena chahiye.",0
MORLY/E/2023/7890124,"Train ko le kar bahut confusion hai, koi bata nahi raha.",0
MORLY/E/2023/8901235,"Mere refund ka paisa nahi aaya, please check karein.",0
MORLY/E/2023/2345678,Train ki timing kabhi kabhi galat hoti hai. Pichli baar 20 min late thi!,0
MORLY/E/2023/3456789,"Mujhe ticket ka refund nahi mila hai, maine payment kiya tha par balance abhi bhi liya hua hai.",0
MORLY/E/2023/4567890,"Station ka cleanliness bahut kharab hai. Kachra har jagah hai, please kuch karein!",0
MORLY/E/2023/5678901,Train ke staff ka behavior bahut rude tha. Unhe training ki zarurat hai.,0
MORLY/E/2023/6789012,Train ki service bekar hai. Kabhi time par nahi aati. Bahut pareshaan hu main.,0
MORLY/E/2023/7890123,Mujhe ticket ka payment do baar cut gaya hai. Kya aap kuch kar sakte hain?,0
MORLY/E/2023/8901234,"Platform par kahi bhi seating nahi hai, log zameen par baith rahe hain. Ye theek nahi hai!",-1
MORLY/E/2023/9012345,Conductor ne mujhe private baat karte hue ignore kiya. Ye theek nahi hai.,0
MORLY/E/2023/0123456,"Train ka service schedule bahut hi bekar hai, kabhi time par nahi aata.",0
MORLY/E/2023/1234560,"Mera payment kuch samasya ki wajah se nahi ho raha, please madad karein.",-1
MORLY/E/2023/2345671,"Station ki building purani ho gayi hai, repair karne ki zarurat hai.",0
MORLY/E/2023/3456782,"Conductors bahut hi bekar hai, unse baat karna mushkil hota hai.",0
MORLY/E/2023/4567893,Mujhe train ka schedule bahut complicated lagta hai. Aasan hona chahiye.,0
MORLY/E/2023/5678904,Mere payment ka status pata nahi chal raha. Bahut samasya hai.,0
MORLY/E/2023/6789015,"Station ki building kharab halat mein hai, iski repair karne ki zarurat hai.",0
MORLY/E/2023/7890126,"Mujhe lagta hai staff ko training ki zarurat hai, unka attitude sahi nahi hai.",0
MORLY/E/2023/8901237,"Mujhe train ke schedule se bahut dikkat ho rahi hai, bahut late aa raha hai.",0
MORLY/E/2023/9012348,Mujhe train ka payment nahi mil raha hai. Bahut dikkat ho rahi hai.,0
MORLY/E/2023/2345678,Mujhe train ki timing ke baare mein complaint hai. Pichle hafte meri train 2 ghante late aayi thi!,0
MORLY/E/2023/3456789,Mujhe apni ticket ki payment ka refund nahi mila. Kya karun?,0
MORLY/E/2023/4567890,Station par staff ka behavior bahut kharab hai. Unhe training ki zarurat hai.,0
MORLY/E/2023/5678901,"Station ki sadak bahut kharab hai, badi dikkat hoti hai. Jaldi theek karein.",-1
MORLY/E/2023/6789012,Mujhe train ke samay par koi bhi update nahi mila. Koi help nahi hui!,0
MORLY/E/2023/7890123,"Mujhe ticket ke liye pay kiya tha, lekin abhi tak confirmation nahi aaya!",0
MORLY/E/2023/8901234,Station par koi bhi staff nahi tha jab mujhe madad ki zarurat thi.,0
MORLY/E/2023/9012345,Platform ki safai nahi ho rahi hai. Bahut ganda hai.,0
MORLY/E/2023/0123456,"Puri train mein koi seat available nahi thi, bahut dikkat hui.",0
MORLY/E/2023/1234560,"Mujhe apne ticket ke liye refund nahi mila hai, please help.",0
MORLY/E/2023/2345601,"Staff ki training ki bahut zarurat hai, nahi toh bahut dikkat hoti hai.",0
MORLY/E/2023/3456012,Platform par safai nahi ho rahi hai. Bahut gandh hai.,0
MORLY/E/2023/4560123,"Train ka schedule bahut hi bekaar hai, koi improvement nahi ho raha.",0
MORLY/E/2023/5670124,Mujhe apne refund ka status nahi mila. Please check karein.,0
MORLY/E/2023/6780125,Mujhe staff se koi madad nahi mili jab zarurat thi.,0
MORLY/E/2023/7890126,"Station par kisi bhi tarah ki infrastructure ki kami hai, bahut takleef hoti hai.",-1
MORLY/E/2023/8901267,"Train schedule bahut ganda hai, koi bhi regular updates nahi hain.",0
MORLY/E/2023/9012678,"Refund ka koi response nahi aaya, kya karna hai?",0
MORLY/E/2023/0126789,"Staff ki training bahut zaruri hai, nahi toh bahut dikkat hoti hai.",0
MORLY/E/2023/1936748,Train late aayi thi aur mujhe meeting mein late hona pada. Aap log aise kaise operate karte ho?,0
MORLY/E/2023/5820143,"Mere ticket ka paisa wapas nahi hua hai, main baar baar call karke bhi kuch nahi kar payi.",0
MORLY/E/2023/7468502,Platform par bahut gandh hai aur bheed bhi bahut hai. Safai nahi ho rahi hai.,0
MORLY/E/2023/6012904,"Railway staff ka behavior bahut kharab tha, unhone mujhe ignore kiya.",0
MORLY/E/2023/4872635,"Mujhe train ka schedule pata nahi chala, bahut samay barbaad hua.",0
MORLY/E/2023/2190548,"Mujhe payment issue ho raha hai, meri transaction fail ho gayi thi.",0
MORLY/E/2023/3456789,"Train station par bahut kharab infrastructure hai, koi bhi cleaning nahi ho rahi.",0
MORLY/E/2023/9876541,"Staff ne mujhe ghalat information di thi, isliye mujhe problem face karni padi.",0
MORLY/E/2023/1234567,"Train ka time table bahut confusing hai, kuch bhi nahi samajh aa raha.",0
MORLY/E/2023/4567890,"Mere payment ka status update nahi ho raha hai, mujhe samajh nahi aa raha.",0
MORLY/E/2023/7890123,Station ka infrastructure kharab hai. Toilets bhi bahut dirty hain.,0
MORLY/E/2023/2345678,"Staff ne mujhe help nahi kiya jab mujhe zaroorat thi, unka behavior achha nahi tha.",0
MORLY/E/2023/6789012,"Train ka time badal gaya tha aur mujhe pata nahi chala, isliye mujhe dikkat hui.",0
MORLY/E/2023/8901234,"Mujhe refund nahi mila, aur kisi ne meri madad nahi ki.",0
MORLY/E/2023/3456781,"Train station ki safety issues hain, kuch nahi kiya gaya hai.",0
MORLY/E/2023/8765432,"Mujhe koi help nahi mili staff se jab mujhe zaroorat thi, iski wajah se mujhe problem aayi.",-1
MORLY/E/2023/2345679,"Mujhe train ke delay ki wajah se badi dikkat hui, kuch nahi kiya ja raha.",0
MORLY/E/2023/9876543,"Mujhe refund nahi mila, customer service se bhi koi madad nahi mili.",0
MORLY/E/2023/6543210,"Station par bahut gandh aur infrastructure ki kami hai, koi sudhar nahi ho raha.",0
MORLY/E/2023/3210001,"Kuch staff ka behavior bilkul theek nahi hai, mujhe bahut pareshani hui.",0
MORLY/E/2023/1234567,Mujhe train ke time pe koi information nahi mil raha hai. Koi staff nahi dikh raha hai.,0
MORLY/E/2023/2345678,"Maine ticket liya tha par payment nahi hua, mujhe refund chahiye!",0
MORLY/E/2023/3456789,"Platform bahut kharab hai, train ka waqt nahi mil raha hai.",0
MORLY/E/2023/4567890,Train ke staff ka behavior bahut kharab hai. Kuch samasya hui thi.,0
MORLY/E/2023/5678901,"Train ka schedule bar bar change ho raha hai, bahut pareshani ho rahi hai.",0
MORLY/E/2023/6789012,"Mujhe ticket ka paisa wapas nahi mil raha hai, bahut samay ho gaya!",0
MORLY/E/2023/7890123,"Railway station pe safai nahi hai, bahut ganda hai!",0
MORLY/E/2023/8901234,"Railway staff se baat karne ka koi fayda nahi, wo sunte nahi.",0
MORLY/E/2023/9012345,"Train ke timings pe koi control nahi hai, bahut samay waste ho raha hai.",0
MORLY/E/2023/0123456,"Mujhe refund nahi mila, maine do baar ticket book ki thi.",0
MORLY/E/2023/1234560,Station ki building bahut purani aur kharab ho gayi hai.,0
MORLY/E/2023/2345671,"Staff se help lene mein bahut pareshani hoti hai, wo help nahi karte.",0
MORLY/E/2023/3456782,"Train ka service bahut bekaar hai, samay par nahi aati.",0
MORLY/E/2023/4567893,"Maine ticket book kiya par payment nahi hua, mujhe help chahiye.",0
MORLY/E/2023/5678904,"Station ke toilet bahut gande hain, safai nahi hoti.",0
MORLY/E/2023/6789015,"Train ke staff ka behavior bahut ganda hai, kuch nahi karte.",0
MORLY/E/2023/7890126,"Train baar baar cancel ho rahi hai, bahut pareshani ho rahi hai.",0
MORLY/E/2023/8901237,"Maine ticket ke liye payment kiya tha, par mujhe confirmation nahi mila.",0
MORLY/E/2023/9012348,"Station pe bahut badbu hai, toilets kaafi gande hain.",0
MORLY/E/2023/0123459,"Staff ki training mein kami hai, wo help nahi karte.",0
MORLY/E/2023/2345670,"Train ka service bilkul bekar hai, time pe nahi aati.",0
MORLY/E/2023/3456781,"Payment nahi ho raha, baar baar try kar rahi hoon.",0
MORLY/E/2023/4567892,"Station ke bahar ka area kaafi kharab hai, ganda hai.",0
MORLY/E/2023/5678903,"Railway staff se help nahi mil rahi, wo ignore karte hain.",0
MORLY/E/2023/5671234,Train ka time pe nahi aana bahut bura hai. Pichle 2 ghante se station pe wait kar raha hoon.,0
MORLY/E/2023/9864321,Mujhe refund ka paisa abhi tak nahi mila. Payment ki details yeh hai: A/C no. XXXXXX1234.,0
MORLY/E/2023/1256789,Staff ka behavior bahut kharab raha. Unhone mujhe jaane nahi diya jab main apni train se late ho gaya.,0
MORLY/E/2023/5432198,Platform bahut ganda hai aur safai nahi ki ja rahi hai. Aisa nahi hona chahiye.,0
MORLY/E/2023/2345678,"Train ko aate hue dekh kar bahut intezar kiya, lekin train aayi hi nahi. Bahut takleef hui.",0
MORLY/E/2023/6781234,Mera ticket cancel ho gaya tha lekin paisa nahi aaya. A/C no. XXXXXX5678.,0
MORLY/E/2023/3456789,Railway personnel ka attitude bahut kharab hai. Unhe train information nahi pata.,-1
MORLY/E/2023/4567890,"Station ki safai bahut kharab hai. Ganda platform hai, yeh bahut bura hai!",0
MORLY/E/2023/7890123,Train ka route change ho gaya. Mujhe nahi pata tha aur mein late ho gaya.,0
MORLY/E/2023/8901234,Mujhe ticket book karne par paisa nahi mila. A/C no. XXXXXX8901.,0
MORLY/E/2023/9012345,Mujhe railway staff se badtameezi ka samna karna pada. Yeh theek nahi hai.,0
MORLY/E/2023/0123456,Railway station ki building kaafi purani ho gayi hai. Iski marammat ki zarurat hai.,0
MORLY/E/2023/1357924,Train late ho gayi aur mujhe meeting miss karni padi. Yeh bilkul galat hai.,0
MORLY/E/2023/2468101,Mera payment abhi tak receive nahi hua. A/C no. XXXXXX4321.,0
MORLY/E/2023/3579134,Personnel ko train schedule ke baare mein nahi pata tha. Bahut yeh bura laga.,0
MORLY/E/2023/4680246,Platform par lamp nahi hai. Raat ko bahut dikkat hoti hai.,0
MORLY/E/2023/5791355,Mujhe train ke timings ki galat jaankari di gayi. Bahut dikkat hui.,0
MORLY/E/2023/6802468,Mujhe refund ka paisa nahi mila. A/C no. XXXXXX1234.,0
MORLY/E/2023/7913579,Mujhe personnel se badtameezi ka samna karna pada. Yeh bilkul galat hai.,-1
MORLY/E/2023/8901357,Railway station ki safai kaafi bekar hai. Yeh bahut kharab hai.,0
MORLY/E/2023/1234567,Train ka schedule bahut hi bura hai. Humesha late hoti hai.,0
MORLY/E/2023/2345678,Mujhe payment ke liye issue aaya hai. Paisa nahi gaya hai.,0
MORLY/E/2023/3456789,Staff ka behavior accha nahi hai. Unhe training ki zarurat hai.,0
MORLY/E/2023/4567890,Station ki cleanliness bahut kharab hai. Toilet bhi gande hain.,0
MORLY/E/2023/5678901,Train ke doston se baat nahi hoti hai jab hum unse madad maangte hain.,-1
MORLY/E/2023/6789012,"Mujhe refund nahi mila hai, transaction ID XXXXXX ka issue hai.",0
MORLY/E/2023/7890123,"Station par staff ka behavior theek nahi hai, unhe train ke bare mein nahi pata tha.",0
MORLY/E/2023/8901234,"Railway station bahut purana hai, facilities bahut kharab hain.",0
MORLY/E/2023/9012345,Train time par nahi aati hai aur koi information nahi milta.,0
MORLY/E/2023/0123456,Mujhe apne refund ke liye koi response nahi mila hai.,0
MORLY/E/2023/1234568,"Train staff bahut rude hai, unka behavior theek nahi hai.",0
MORLY/E/2023/2345679,"Bridge bahut purana ho gaya hai, iska sudhar zaruri hai.",0
MORLY/E/2023/3456790,"Train ki services bahut bekar hain, samay par nahi milti.",0
MORLY/E/2023/4567891,"Transaction karne par amount nahi gaya, support nahi mila.",0
MORLY/E/2023/5678902,"Staff ko training ki zarurat hai, unhe knowledge nahi hai.",0
MORLY/E/2023/6789013,"Station ki building bahut purani ho gayi hai, repair zaroori hai.",0
MORLY/E/2023/7890124,"Train ka time bahut badal raha hai, kisi ko pata nahi hai.",0
MORLY/E/2023/8901235,"Payment ka process bahut complex hai, madad chahiye.",0
MORLY/E/2023/9012346,Staff ko customer service training ki zarurat hai.,0
MORLY/E/2023/1234567,Train ka time pe nahi aana bahut pareshan kar raha hai. Kabhi kabhi toh 2 ghante late hoti hain!,0
MORLY/E/2023/2345678,Mujhe payment process mein dikkat aa rahi hai. Bar-bar try karne par bhi fail ho raha hai.,0
MORLY/E/2023/3456789,Train ke staff se baat karne mein mushkil hoti hai. Koi madad nahi karta.,0
MORLY/E/2023/4567890,Station pe bahut saari facilities nahi hain. Toilet kaafi ganda hai aur safai nahi hoti.,0
MORLY/E/2023/5678901,"Train ki frequency bahut kam hai, aaj kal toh aam janta ko bhi dikkat hoti hai.",0
MORLY/E/2023/6789012,"Mera ticket cancel ho gaya, lekin refund nahi mil raha hai. Aaj kal process bahut slow hai.",0
MORLY/E/2023/7890123,"Train ke guards logon se baat nahi karte, train mein samasya hoti hai toh koi help nahi karta.",0
MORLY/E/2023/8901234,"Station ki cleaning bahut bekar hai, kaafi baar report kiya hai par kuch nahi ho raha.",0
MORLY/E/2023/9012345,"Train mein AC kaam nahi kar raha tha, safar mein bahut pareshani hui.",0
MORLY/E/2023/0123456,"Mujhe online ticket ka payment nahi mil raha hai, baar baar error aa raha hai.",0
MORLY/E/2023/1234500,"Train ke ticket collector ka behavior accha nahi hai, sabko darate hain.",0
MORLY/E/2023/2345601,"Platform ki safai kaafi bekar hai, khud dekhne ke liye aana padta hai.",-1
MORLY/E/2023/3456702,"Train mein bahut jyada crowd hota hai, koi control nahi hai. Kabhi kabhi toh log gir jaate hain.",0
MORLY/E/2023/4567803,"Refund ka paisa ab tak nahi mila, deadline cross ho gayi hai.",0
MORLY/E/2023/5678904,"Station pe koi staff nahi hota kabhi kabhi, madad ke liye bahut pareshani hoti hai.",0
MORLY/E/2023/6789015,"Roads station tak bahut kharab hain, yeh bahut dikkat karte hain safar mein.",0
MORLY/E/2023/7890126,"Train ka schedule bahut bekar hai, baar baar change hota hai. Aise safar karna mushkil hai.",0
MORLY/E/2023/8901237,"Mere credit card ka payment online nahi ho raha hai, baar baar error aa raha hai.",0
MORLY/E/2023/9012348,Staff ki training nahi hui hai. Train mein koi madad nahi karta.,-1
MORLY/E/2023/0123459,Station ki facilities bilkul kharab hain. Bahut saari cheezein missing hain.,0
MORLY/E/2023/4723101,"Train ka time bahut late hai, is wajah se mujhe kaafi samasya ho rahi hai. Kripya kuch kijiye.",0
MORLY/E/2023/3457890,Mujhe ticket ka refund nahi mila. Uske liye maine payment kiya tha par abhi tak kuch nahi aaya.,0
MORLY/E/2023/8765432,Chennai station par facilities bahut kharab hai. Toilets aur waiting area kaafi gande hain.,0
MORLY/E/2023/1357980,Kolkata station par staff ka behavior accha nahi tha. Unhe training ki zarurat hai.,0
MORLY/E/2023/4568901,Train ki timing bahut kharab hai. Mujhe baar baar late hota hai aur kaam bhi miss hota hai.,0
MORLY/E/2023/6781234,Mujhe ticket ka refund nahi mila. Maine 2 mahine pehle cancel kiya tha.,0
