registration_no,subject_content_text,dbscan_cluster
MORLY/E/2023/8901234,"Train mein ac nahi chal raha tha, bohot garmi thi. Kya aap log kuch karke nahi dekh sakte?",0
MORLY/E/2023/9012345,"Mera payment process abhi bhi pending hai, aap log kya kar rahe hain?",0
MORLY/E/2023/0123456,"Platform ki safai nahi hai, bahut gandh hai, yeh theek karna chahiye.",0
MORLY/E/2023/1234560,Railway staff ki training kaafi kamzor hai. Is par dhyan dena chahiye.,0
MORLY/E/2023/2345601,"Train ki timing kabhi kabhi sahi nahi hoti, aap log kya kar rahe hain?",0
MORLY/E/2023/3456012,"Mera payment abhi bhi pending hai, aap log kyun nahi suljha rahe?",0
MORLY/E/2023/4560123,"Railway station ki building purani ho gayi hai, iski marammat honi chahiye.",0
MORLY/E/2023/5601234,"Railway staff ka attitude accha nahi hai, is par dhyan dena chahiye.",0
MORLY/E/2023/6012345,"Mujhe train ka ticket nahi mila hai, refund ka kya hoga?",0
MORLY/E/2023/1234567,"Mere ticket ki payment ho gayi hai, par ticket nahi mila. Kya karun?",0
MORLY/E/2023/2345678,"Station par washroom ki suvidha nahi hai, is par dhyan dena chahiye.",0
MORLY/E/2023/3456789,"Railway staff ki training kaafi kam hai, isse service affect hoti hai.",0
MORLY/E/2023/1234567,Train number 12345 baar baar late ho raha hai. Pichle teen baar to 2 ghante late tha!,0
MORLY/E/2023/2345678,Maine ticket cancel kiya tha lekin paisa nahi mila. Customer care se sampark karne par bhi koi jawab nahi mila.,0
MORLY/E/2023/3456789,"Platform par safai nahi hoti, bahut ganda hai. Khud aakar dekho!",0
MORLY/E/2023/4567890,Train staff rude hain aur koi madad nahi kar raha. Humara experience bahut kharab hai.,0
MORLY/E/2023/5678901,"Train ki timing sahi nahi hai, pichle 4 din se delay ho raha hai. Kya kar rahe ho?",0
MORLY/E/2023/6789012,"Maine ticket liya tha par paisa account me nahi aaya, kya hua?",0
MORLY/E/2023/7890123,"Platform par gaddhe hain, koi dhyaan nahi de raha! Safety hazard hai.",-1
MORLY/E/2023/8901234,"Staff se koi help nahi mili, bahut hi bura experience tha.",0
MORLY/E/2023/9012345,"Train chhut gayi, koi information nahi mili. Kya aap log kuch nahi karte?",0
MORLY/E/2023/0123456,"Mujhe ticket ka refund nahi mila, bahut waqt ho gaya. Customer care se baat karne me bhi dikkat hoti hai.",0
MORLY/E/2023/1234567,Station par facilities kharab hain. Bathrooms bahut gande hain!,0
MORLY/E/2023/2345678,"Train staff se koi help nahi mili, unki attitude bahut kharab hai.",0
MORLY/E/2023/3456789,"Trains ki timings bilkul sahi nahi hai, bahut late ho raha hai.",0
MORLY/E/2023/4567890,"Mera refund nahi aaya, customer service ko call kiya par kuch nahi mila.",0
MORLY/E/2023/5678901,"Station ka infrastructure bahut kharab hai, kuch bhi sahi nahi hai.",0
MORLY/E/2023/6789012,"Train ke staff se koi help nahi mili, bahut time waste hota hai.",0
MORLY/E/2023/7890123,"Train ka schedule bilkul sahi nahi hai, bahut delay hota hai.",0
MORLY/E/2023/8901234,"Refund process mein dikkat aa rahi hai, please madad karein.",0
MORLY/E/2023/7654321,Train ka schedule hamesha delay hota hai. Hum vishesh roop se pareshan hain.,0
MORLY/E/2023/9876543,Mujhe payment refund nahi mila hai pichle 15 din se. Kripya madad karein.,0
MORLY/E/2023/6543210,Station staff ka behavior bahut bura hai. Unhe training ki zarurat hai.,0
MORLY/E/2023/3456789,"Platform ka condition bahut kharab hai, khudko surakshit mehsoos nahi hota.",0
MORLY/E/2023/4567890,Train ki timings sahi nahi hai. Kaafi samay nahi milta hai.,0
MORLY/E/2023/8765432,"Mujhe cancellation ke baad bhi refund nahi mila, bahut pareshaan hoon.",0
MORLY/E/2023/1234568,"Staff ke behavior kaafi kharab hai, unko training ki zarurat hai.",0
MORLY/E/2023/2345679,"Railway station ka infrastructure bahut purana hai, badlaav ki zarurat hai.",0
MORLY/E/2023/3456781,Mere train ka cancellation bina kisi notification ke hua. Yeh acha nahi hai.,0
MORLY/E/2023/6789012,"Payment gateway me dikkat aa rahi hai, kuch bhi karne par bhi payment nahi ho raha.",0
MORLY/E/2023/2345670,"Railway staff se mere saath achha vyavhar nahi hua, iski jaanch honi chahiye.",-1
MORLY/E/2023/3456782,"Station par bahut gande paani ki samasya hai, is par action lena chahiye.",0
MORLY/E/2023/4567891,"Train ki aawagaman me bahut samasya aa rahi hai, kya aap kuch kar sakte hain?",0
MORLY/E/2023/5678903,"Mainne ticket ka payment kiya tha aur ab tak nahi mila, bahut pareshaan hoon.",0
MORLY/E/2023/6789014,Station staff ka vyavhar theek nahi hai. Is par action lena chahiye.,0
MORLY/E/2023/7890126,"Station par saaf safai ki kami hai, ise turant sudharna chahiye.",0
MORLY/E/2023/8901238,"Mere train ke aane ka samay baar baar badal raha hai, is par dhyaan dein.",0
MORLY/E/2023/9012340,"Maine ticket book kiya tha par payment nahi hua, bahut samasya ho rahi hai.",0
MORLY/E/2023/4567891,"Train ka schedule bahut late ho gaya hai, kuch nahi ho raha hai.",0
MORLY/E/2023/3456782,"Mere payment ka confirmation nahi aaya hai, samasya hai.",0
MORLY/E/2023/2345673,"Staff ka behaviour bahut kharab hai, koi help nahi kar raha hai.",0
MORLY/E/2023/5678904,"Railway station ka clean nahi hai, bahut ganda hai.",0
MORLY/E/2023/6789015,"Train ka service bahut slow hai, koi improvement nahi dikh raha hai.",0
MORLY/E/2023/7890126,"Online booking ke liye payment nahi ho raha hai, kuch samasya hai.",0
MORLY/E/2023/8901237,"Staff ki training nahi hui hai, unhe kaam sahi se nahi karna aata hai.",0
MORLY/E/2023/9012348,"Platform pe safai nahi hai aur light bhi nahi hai, bahut dikkat ho rahi hai.",0
MORLY/E/2023/0123459,"Train ke timings barabar nahi hain, baar baar delay ho raha hai.",0
MORLY/E/2023/1234560,"Payment nahi ho raha hai, account ka detail bhi sahi nahi dikh raha hai.",-1
MORLY/E/2023/2345678,"Koi bhi staff madad nahi kar raha hai, bahut samasya ho rahi hai.",0
MORLY/E/2023/3456789,"Railway station ka infrastructure bahut kharab hai, bahut dikkat ho rahi hai.",0
MORLY/E/2023/4567890,"Train ki services mein bahut samasya hai, baar baar seat nahi mil rahi hai.",0
MORLY/E/2023/5678901,"Mera ticket ka payment pending hai, please jaldi dekhen.",0
MORLY/E/2023/6789012,"Kuch staff rude hain, unki training karni chahiye.",-1
MORLY/E/2023/7890123,"Station par facilities kharab hain, please dekhen.",0
MORLY/E/2023/8901234,"Mujhe train ka seat nahi mila, baar baar delay ho raha hai.",0
MORLY/E/2023/9012345,"Payment nahi mil raha hai, account ki details galat lag rahi hain.",0
MORLY/E/2023/0123456,"Staff ko training ki zaroorat hai, unka behaviour sahi nahi hai.",0
MORLY/E/2023/1234567,"Station ki facilities bilkul kharab hain, jaise toilets gande hain.",0
MORLY/E/2023/2345678,"Train time pe nahi aayi, mujhe kaafi der tak wait karna pada. Kya yeh koi normal baat hai?",0
MORLY/E/2023/3456789,"Mujhe ticket ke liye payment nahi hua, par paisa card se cut gaya hai. Kya karun?",0
MORLY/E/2023/4567890,"Train ke staff ne mujhe achha samjha nahi, baar baar kehne par bhi. Yeh to sahi nahi hai!",0
MORLY/E/2023/5678901,"Station kaafi ganda hai, safai ka koi khayal nahi rakha ja raha. Yeh bilkul unacceptable hai!",0
MORLY/E/2023/6789013,Mera train cancel ho gaya bina kisi notice ke. Yeh kaise chalta hai?,0
MORLY/E/2023/7890125,"Mujhe refund nahi mila, jabki maine cancel kiya tha. Kya aap log is par kuch kar sakte hain?",0
MORLY/E/2023/8901235,"Staff ki behaviour bahut bura tha, unhe train ki zarurat hai service mein。",0
MORLY/E/2023/1234569,"Railway tracks kaafi kharab hai, kuch accident ho sakta hai. Is par kuch karna zaruri hai.",0
MORLY/E/2023/2345670,Mujhe pata chala hai ki meri train ka schedule change ho gaya hai bina kisi notice ke. Yeh galat hai.,0
MORLY/E/2023/3456781,Maine ticket book kiya lekin payment abhi tak nahi hui. Kya aap is par kuch kar sakte hain?,0
MORLY/E/2023/6789014,"Station ki facilities bohot kharab hain, toilets bhi saaf nahi hain.",0
MORLY/E/2023/8901236,"Meri train baar baar der ho rahi hai, ab to ye ek problem ban gayi hai.",0
MORLY/E/2023/1234560,"Refund ke liye maine request ki thi, ab tak mujhe koi jankari nahi mili. Kya kar sakte hain?",0
MORLY/E/2023/2345672,"Mera experience staff ke saath theek nahi tha, unhe sambhalna padega.",-1
MORLY/E/2023/6789012,"Station ki building ki condition achchi nahi hai, kuch action lena padega.",0
MORLY/E/2023/1234568,"Aaj meri train bilkul time pe nahi aayi, kya yeh koi naya trend hai?",0
MORLY/E/2023/3456782,"Payment ke liye problem aa rahi hai, mujhe koi solution nahi mila.",0
MORLY/E/2023/7890123,"Staff ka behaviour theek nahi hai, unhe sambhalna padega.",0
MORLY/E/2023/8901239,"Kuch infrastructure problems hain, station par kaam karne ki zarurat hai.",-1
MORLY/E/2023/1234567,"Pehle se booked train ka time change ho gaya hai, iska kuch nahi hota kya? Bahut pareshani hoti hai!",0
MORLY/E/2023/2345678,"Maine ticket book kiya tha lekin payment nahi hui. Bahut baar try kiya, kya karun?",0
MORLY/E/2023/3456789,Train staff ka behaviour bahut kharab tha. Unhe training ki zaroorat hai. Kya aap kuch kar sakte hain?,0
MORLY/E/2023/4567890,"Station par paani ki samasya hai, washroom bhi bahut gandha hai. Kya aap iski sudhar kar sakte hain?",-1
MORLY/E/2023/5678901,"Train khud kisi aur station par ruk gayi. Jis station par mujhe utarna tha, wahan nahi ruk gayi. Yeh kyun hua?",0
MORLY/E/2023/6789012,"Maine cash payment kiya, lekin ticket nahi mila. Kya mujhe refund milega?",0
MORLY/E/2023/7890123,Train ke conductor ne mujhe ghalat information di. Yeh kya hai? Koi accountability nahi hai kya?,0
MORLY/E/2023/8901234,"Station par platform kharab hai, girne ka khatara hai. Jaldi kijiye!",-1
MORLY/E/2023/9012345,"Train time se nahi aayi, mujhe meeting miss karni padi. Kya yeh thik hai?",0
MORLY/E/2023/0123456,"Ticket refund nahi mila, jabki cancellation kiya tha. Kya yeh sahi hai?",0
MORLY/E/2023/1234568,Train mein koi staff nahi tha madad ke liye. Nahi kisi ne kuch kiya. Yeh kya service hai?,0
MORLY/E/2023/2345679,Railway station par parking ki samasya hai. Koi jagah nahi milta. Aap log kya kar rahe hain?,0
MORLY/E/2023/3456780,Train ka schedule bahut confuse hai. Iski clarity nahi hai. Kya aap is par kuch kar sakte hain?,0
MORLY/E/2023/4567891,"Mujhe PNR ka refund nahi mila, jab ki maine cancellation kiya tha. Kya yeh sahi hai?",0
MORLY/E/2023/5678902,"Train staff ki training bahut zaroori hai, kyunki woh passengers se achha behave nahi karte.",0
MORLY/E/2023/6789013,"Railway station par lift kharab hai, budhe logon ko mushkil hoti hai. Ispar kuch kiya jaye?",0
MORLY/E/2023/7890124,Train ka schedule bahut confuse hai. Iski clarity nahi hai. Kya aap is par kuch kar sakte hain?,0
MORLY/E/2023/8901235,"Mujhe ticket ka refund nahi mila, jab ki maine cancellation kiya tha. Kya yeh sahi hai?",0
MORLY/E/2023/9012346,"Train staff ka behavior bahut kharab hai. Unhe training ki zaroorat hai, yeh kya hai?",0
MORLY/E/2023/1234567,Mujhe apne ticket ka refund nahi mila. Maine payment kiya tha lekin ab tak kuch nahi aaya.,0
MORLY/E/2023/2345678,"Train aaj bahut late aayi, is wajah se mujhe kaafi dikkat hui. Kya aap kuch kar sakte hain?",0
MORLY/E/2023/3456789,Station ki cleanliness bahut kharab hai. Kya aap kuch kar sakte hain?,0
MORLY/E/2023/4567890,Railway staff ne mujhe achhe se assist nahi kiya. Bahut bekar service mili.,-1
MORLY/E/2023/5678901,Mujhe apne ticket ka payment confirm nahi mila. Bahut pareshani ho rahi hai.,0
MORLY/E/2023/6789012,"Train delay ho gaya hai, kya koi solution hai iske liye?",0
MORLY/E/2023/7890123,"Platform bahut kharab hai, badalna padega, samasya hai.",0
MORLY/E/2023/8901234,"Staff ki behavior acchi nahi hai, training ki zarurat hai.",0
MORLY/E/2023/9012345,"Mujhe payment ka confirmation nahi mila, help karein.",0
MORLY/E/2023/0123456,"Train ki timing bahut ajeeb hai, please check karein.",0
MORLY/E/2023/1234568,"Platform par safai nahi hoti, badalna hoga.",0
MORLY/E/2023/2345679,"Staff ki training mein kami hai, please dekhein.",0
MORLY/E/2023/3456780,"Mujhe apne ticket ka paisa wapas nahi mila hai, please help.",0
MORLY/E/2023/4567891,"Train ek ghanta late hai, kuch action lo please.",0
MORLY/E/2023/5678902,"Station par bahut pareshani ho rahi hai, infrastructure kharab hai.",0
MORLY/E/2023/6789013,"Kuch staff ne rude behavior kiya, shikayat hai.",0
MORLY/E/2023/7890124,Mera ticket ka payment abhi tak nahi aaya. Bahut pareshaan hoon.,0
MORLY/E/2023/8901235,"Train ka schedule bilkul galat hai, please rectify karein.",0
MORLY/E/2023/9012346,"Railway station ki condition kharab hai, please dhyan de.",0
MORLY/E/2023/1234567,"Mere train ka time bahut late ho raha hai, koi solution nahi hai kya?",0
MORLY/E/2023/2345678,"Mujhe payment karne me dikkat aa rahi hai, koi madad kare?",0
MORLY/E/2023/3456789,"Railway staff rude hain, unse baat karne me dikkat hoti hai.",0
MORLY/E/2023/4567890,"Station par cleanliness nahi hai, bahut ganda hai.",0
MORLY/E/2023/5678901,"Meri train ka schedule baar baar change hota hai, samasya kyu nahi suljha rahe?",0
MORLY/E/2023/6789012,"Payment refund nahi ho raha hai, bahut pareshaan hoon.",0
MORLY/E/2023/7890123,"Staff ki training achi nahi hai, unhe improve karna hoga.",0
MORLY/E/2023/8901234,"Platform bahut chhota hai, logon ko dikkat hoti hai.",0
MORLY/E/2023/9012345,"Train ki timing hamesha late hoti hai, yeh unacceptable hai.",0
MORLY/E/2023/0123456,"Mujhe payment issue ka samadhan chahiye tha, koi update nahi hai?",0
MORLY/E/2023/1234568,"Kuch staff ki training sahi nahi hai, unhe improve karna padega.",0
MORLY/E/2023/2345679,"Platform ki sthiti bahut kharab hai, yeh badalna chahiye.",0
MORLY/E/2023/3456780,"Train ka operation bahut bekaar hai, samasya jaldi suljhaayein.",-1
MORLY/E/2023/4567891,"Mujhe refund nahi mila hai, bahut pareshaan ho raha hoon.",0
MORLY/E/2023/5678902,"Kuch staff ki training nahi hui hai, yeh unacceptable hai.",0
MORLY/E/2023/6789013,"Station ki facilities bahut kharab hain, behtar karna padega.",0
MORLY/E/2023/7890124,"Kuch trains ka operation accha nahi hai, please dekhiye.",-1
MORLY/E/2023/8901235,"Refund ka samadhan nahi hua hai, main pareshaan hoon.",0
MORLY/E/2023/9012346,"Staff ka behavior achha nahi hai, unhe sudhaarna hoga.",0
MORLY/E/2023/0123457,"Washroom ki cleanliness bahut kharab hai, please dekhiye.",0
MORLY/E/2023/1234569,"Train ka operational timing bahut galat hai, please ise sudharein.",0
MORLY/E/2023/1234567,Train ka schedule bahut gadbad hai. Kahi baar yatra ke waqt train late hoti hai. Please kuch karein.,0
MORLY/E/2023/2345678,Mujhe ticket ke liye payment karne mein problem ho rahi hai. Account se paise nahi kat rahe hain.,0
MORLY/E/2023/3456789,Railway station ke washroom bahut gande hain. Kya inhe theek kiya ja sakta hai?,0
MORLY/E/2023/4567890,Train ke seats issue ho rahe hain. Bahut baar waitlisted tickets ho rahi hain. Help please!,0
MORLY/E/2023/5678901,Railway staff ko customer service ki training nahi di gayi hai. Isse customer kaafi pareshan hote hain.,0
MORLY/E/2023/6789012,Mere refund ka paisa ab tak nahi aaya hai. Kya aap dekh sakte hain ki kya hua?,0
MORLY/E/2023/7890123,"Platform ka haal bahut kharab hai, please kuch karein. Ye bahut dangerous hai.",0
MORLY/E/2023/8901234,"Train time par nahi aati, yeh sabse annoying hai. Kripya is par dhyan den.",0
MORLY/E/2023/9012345,Railway person ki behavior bahut bekar hai. Unhe training ki zarurat hai!,0
MORLY/E/2023/0123456,"Mujhe refund nahi mila hai, kya aap iski jaanch kar sakte hain?",0
MORLY/E/2023/1234560,"Station pe paani aur saaf safai ki kami hai, ye ek samasya hai.",0
MORLY/E/2023/2345607,Kahi baar train ka time badal jaata hai bina kisi notice ke. Ye bahut dikkat hai.,0
MORLY/E/2023/3456708,"Staff ka behavior acha nahi hai, unhe training ki zarurat hai.",0
MORLY/E/2023/4567809,Mujhe payment issue face karna pad raha hai. Account se paise nahi cut rahe hain.,0
MORLY/E/2023/5678902,"Platform par safai nahi hai, bahut samasya hai. Please kuch karein.",0
MORLY/E/2023/6789013,"Train schedule bahut kharab hai, baar-baar late ho rahi hai. Please check.",0
MORLY/E/2023/7890124,"Railway staff ka behavior improve karna zaruri hai, wo bahut rude hain.",0
MORLY/E/2023/8901235,"Mujhe payment ka issue hai, kya aap madad kar sakte hain?",0
MORLY/E/2023/9012346,"Station par facilities bahut kharab hain, humara kya hoga?",0
MORLY/E/2023/7654321,"Mujhe payment refund nahi mila. Maine train ke liye pay kiya tha, lekin koi confirmation nahi aaya.",0
MORLY/E/2023/2345678,Platform par bahut zyada gande hai aur koi cleaning nahi kar raha. Yeh bilkul unacceptable hai.,0
MORLY/E/2023/3456789,"Meri train time par nahi aayi. Schedule disturb ho gaya, please iski jaanch kijiye.",0
MORLY/E/2023/1234567,"Train ke staff achhe nahi the, bahut rude they. Is par action lena chahiye.",0
MORLY/E/2023/3456789,"Maine ticket purchase kiya, par mera paisa deduct ho gaya par ticket nahi mili.",0
MORLY/E/2023/5678901,"Railway station par safety issues hain, bahut saare light kharab hain. Koi action kyun nahi ho raha?",0
MORLY/E/2023/6789012,Mujhe train ka schedule update nahi mila. Bahut confusion ho raha hai.,0
MORLY/E/2023/7890123,"Train ke staff ki training achhi nahi hai, service bahut bekar hai.",0
MORLY/E/2023/8901234,"Mujhe ticket ka paisa nahi mila, bank statement par dikh nahi raha hai.",0
MORLY/E/2023/9012345,"Platform par behtareen lighting ki kami hai, raat ko dikhayi nahi deta.",0
MORLY/E/2023/0123456,Mujhe train ka timing change hone ki jankari nahi mili. Bahut dikkat ho rahi hai.,0
MORLY/E/2023/1234578,"Train ke staff ne mujhe bekar se treat kiya, is par action lena zaroori hai.",0
MORLY/E/2023/2345689,Mujhe apne ticket ka paisa return nahi mila. Bahut din ho gaye.,0
MORLY/E/2023/3456790,"Station par bahut saare potholes hain, koi nahi dekh raha is par. Please dhyan dijiye.",0
MORLY/E/2023/4567901,"Train ke timings baar baar change ho rahe hain, is par kuch karna chahiye.",0
MORLY/E/2023/5678912,"Mujhe staff ki training ki kami dikh rahi hai, service kaafi poor hai.",0
MORLY/E/2023/6789023,"Mujhe train ka ticket cancel karne par paisa nahi mila, mujhe bataya nahi gaya.",0
MORLY/E/2023/7890134,"Station ka infrastructure kaafi purana hai, iski sudhar ki zarurat hai.",0
MORLY/E/2023/8902345,"Mere ghar par railway track ke paas bahut noise hai, is par zarurat hai ki kuch action liya jaye.",-1
MORLY/E/2023/9012456,"Mujhe staff ki behavior kaafi bekar laga, is par kuch action lena chahiye.",0
MORLY/E/2023/1234567,Train ka time baar baar badal raha hai! Yeh bahut pareshan kar raha hai. Kya aap log kuch kar sakte hain?,0
MORLY/E/2023/7654321,"Maine ticket cancel kiya tha, lekin refund nahi aaya. Kya aap iski jaanch kar sakte hain? PNR: X123X45.",0
MORLY/E/2023/2345678,Platform par safai nahi hoti hai. Bahut gandh hai aur sthal par kachra hai. Yeh rail yatra mein samasya hai.,0
MORLY/E/2023/3456789,Railway staff behaving rudely with passengers. Kya aap is par kuch kar sakte hain? Yeh unacceptable hai.,0
MORLY/E/2023/4567890,"Train delays bahut ho rahe hain. Mere office ka time miss ho raha hai, please kuch karein!",0
MORLY/E/2023/5678901,Mujhe ticket book karne par extra charges lage hain. Kya yeh sahi hai? Account no: XXXXXX1234.,0
MORLY/E/2023/6789012,Station pe lift kharab hai. Bahut log pareshan ho rahe hain. Kya aap is par dhyan de sakte hain?,0
MORLY/E/2023/7890123,"Train conductors are not helping passengers with queries. Yeh bahut samasya hai, please dekhein.",0
MORLY/E/2023/8901234,Mujhe ticket book karne par samasya aayi. Kya aap meri madad kar sakte hain? PNR: XXXXXX.,0
MORLY/E/2023/9012345,Maine ek mistake se do tickets book kar di hain. Kya aap meri ek ticket cancel kar sakte hain? Yahan PNR: XXXXXX hai.,0
MORLY/E/2023/0123456,"Platform par seats kharab hain, sitting nahi hoti hai. Kya aap kuch kar sakte hain?",-1
MORLY/E/2023/1234568,"Mujhe railway staff se achha vyavhar nahi mila. Yeh bahut bura hai, please dekhein.",-1
MORLY/E/2023/2345679,Train ka local timing sahi nahi hai. Aap log kuch kar sakte hain? Bahut dikkat hoti hai.,0
MORLY/E/2023/3456780,Mujhe refund nahi mila hai jabki maine cancel kiya tha. Kya yeh sahi hai? PNR: XXXXXX.,0
MORLY/E/2023/4567891,Railway station pe washroom bahut gande hain. Kya aap kuch kar sakte hain?,0
MORLY/E/2023/5678902,Koi staff mere prashna ka jawab nahi de raha. Yeh bahut samasya hai. Kya aap kuch kar sakte hain?,0
MORLY/E/2023/6789013,"Mujhe train ka schedule baar baar badal raha hai. Bahut pareshani hoti hai, please dekhein.",0
MORLY/E/2023/7890124,Mujhe meri payment nahi mili hai jabki maine ticket book kiya tha. Kya yeh samasya hai? Account: XXXXXX.,0
MORLY/E/2023/4512367,"Train time pe nahi aayi, bahut dikkat hui. Mere paas koi aur option nahi tha.",0
MORLY/E/2023/9823465,"Mujhe refund nahi mila, payment details bhi sahi nahi hain, help karo.",0
MORLY/E/2023/3748921,"Platform bahut kharab hai, paani bhara rehta hai, koi dekhne wala nahi hai.",0
MORLY/E/2023/4857321,"Staff ka behavior bilkul accha nahi tha, ghamandi the sab log.",0
MORLY/E/2023/1098765,"Train ki seat confirm nahi hui, fir bhi ticket ka paisa kahan gaya?",0
MORLY/E/2023/3456789,"Payment gateway par error aa raha hai, kya karu.",0
MORLY/E/2023/5678123,"Station par safai nahi hoti, bahut ganda hai, koi dhyan nahi de raha.",0
MORLY/E/2023/6789432,"Train staff ka behavior sahi nahi hai, rude hain sab.",0
MORLY/E/2023/9876540,"Train bahut late ho gayi, koi update nahi diya.",0
MORLY/E/2023/1234567,Mera ticket cancel ho gaya aur main refund nahi mil raha. Kya karun?,0
MORLY/E/2023/4567891,"Platform bahut kharab hai, sab jagah gande paani bhare hue hain.",0
MORLY/E/2023/1122334,Staff ka behavior bahut rude tha. Koi respect nahi diya.,0
MORLY/E/2023/3344556,"Train ka timing wrong hai, kabhi bhi nahi aata.",-1
MORLY/E/2023/6543210,Mera payment process nahi ho raha. Bahut baar try kiya.,0
MORLY/E/2023/7890123,"Railway station ki safai bahut kharab hai, koi dhyan nahi de raha.",0
MORLY/E/2023/4567892,"Railway staff ka behavior accha nahi hai, rude hai sabhi.",0
MORLY/E/2023/7896541,"Train ka time sahi nahi hai, baar baar late ho rahi hai.",0
MORLY/E/2023/1357924,"Mera payment refund nahi ho raha, bahut problem ho rahi hai.",0
MORLY/E/2023/2468135,"Station ke washrooms bahut gande hain, koi safai nahi kar raha.",0
MORLY/E/2023/9876543,"Staff ke behavior mein sudhar ki zarurat hai, unse baat nahi karte.",0
MORLY/E/2023/5432167,"Train ka timing sahi nahi hai, baar baar late hai.",0
MORLY/E/2023/6789123,"Payment ka status nahi dikh raha hai, kya karun?",0
MORLY/E/2023/8357493,Train ka timing hamesha late hota hai. Kabhi kabhi to 2 ghante bhi late aa jati hai.,0
MORLY/E/2023/3456712,Mere ticket ka refund nahi aa raha hai. Payment to deduct ho gaya tha.,0
MORLY/E/2023/9876451,Station par safai nahi hoti. Bahut ganda hai waha.,0
MORLY/E/2023/4567890,Train staff ka behavior bahut kharab hai. Unhe training ki zarurat hai.,0
MORLY/E/2023/2365894,Train ka route galat hai. Baat karne par koi sunta nahi hai.,0
MORLY/E/2023/7890123,Mere credit card se ticket purchase kiya tha. Abhi tak confirmation nahi aaya.,0
MORLY/E/2023/1234567,"Platform par rukawat hai, logon ke liye bahut mushkil hota hai.",0
MORLY/E/2023/6543210,Guard ko na samajh aa raha tha aur na koi help kar raha tha. Kya yeh theek hai?,-1
MORLY/E/2023/2389471,"Train ke seats reserve nahi ho rahe hai, baar-baar try karne par bhi.",0
MORLY/E/2023/8945610,Mere account se paisa deduct ho gaya par ticket confirm nahi hui.,0
MORLY/E/2023/0123456,"Station ki buildings purani ho gayi hain, khud ko surakshit mehsoos nahi kar raha.",-1
MORLY/E/2023/3456789,"Railway staff ko customer service ka pata nahi hai, shayad training ki zaroorat hai.",0
MORLY/E/2023/5678901,"Train ke seats nahi dikh rahe hain, jaise ki koi galti ho rahi ho.",0
MORLY/E/2023/6789012,"Payment confirm nahi hui hai, par paisa to deduct ho gaya.",0
MORLY/E/2023/7891234,"Station ki facilities kharab hain, bahut dikkat hoti hai.",0
MORLY/E/2023/8912345,"Train ke conductor ko samasya ka samadhan nahi aata, bahut samay waste hota hai.",-1
MORLY/E/2023/2345678,"Train ka schedule bahut hi confusing hai, clear nahi hota.",0
MORLY/E/2023/9876543,"Aaj ka ticket lene mein problem aayi, nahi samajh aaya kya karna tha.",0
MORLY/E/2023/3450123,"Station ki lights kharab hain, andhera hota hai raat ko.",0
MORLY/E/2023/4567891,"Railway personnel bahut rude hain, unka attitude improve karne ki zarurat hai.",0
MORLY/E/2023/2345678,"Meri train baar baar late ho rahi hai, mujhe office time se pahunchna hai. Please kuch karein.",0
MORLY/E/2023/3456789,"Mujhe ticket ka paise wapas nahi mila, woh toh cancel ho gaya tha! Kya karun?",0
MORLY/E/2023/4567890,"Mere saath kisi staff ne accha vyavhaar nahi kiya, main kaafi pareshan hoon.",0
MORLY/E/2023/5678901,"Station par safai nahi ho rahi hai, bahut ganda hai. Kya kuch ho sakta hai?",0
MORLY/E/2023/6789012,Kuch trains ki schedule update nahi hoti. Bahut badi dikkat ho rahi hai!,0
MORLY/E/2023/7890123,Mujhe refund nahi mila ticket cancel hone par. Bahut samasya ho rahi hai.,0
MORLY/E/2023/8901234,"Train ke staff ka behavior acha nahi tha, mujhe bahut bura laga.",0
MORLY/E/2023/9012345,"Railway station par facilities bahut kharab hai, bahut dikkat hoti hai.",0
MORLY/E/2023/0123456,Mujhe samajh nahi aa raha ki train kaise chalu hoti hai. Help chahiye.,0
MORLY/E/2023/1234567,"Mujhe refund nahi mila, kya aap log meri madad kar sakte hain?",0
MORLY/E/2023/2345678,"Staff ka behavior mujhe acha nahi laga, kaise isse report karu?",0
MORLY/E/2023/3456789,"Station par washrooms bahut gande hain, kafi samasya ho rahi hai.",0
MORLY/E/2023/4567890,"Train ka schedule samajhne mein dikkat ho rahi hai, please madad karein.",0
MORLY/E/2023/5678901,"Maine ticket ke liye payment kiya tha, par abhi tak confirmation nahi mila hai.",0
MORLY/E/2023/6789012,"Staff se baat karne mein problem ho rahi hai, samasya suljha nahi rahi.",0
MORLY/E/2023/7890123,Railway station par parking ki bahut kami hai. Bahut samasya ho rahi hai.,0
MORLY/E/2023/8901234,Kuch trains ki timing sahi nahi hai. Bahut dikkat ho rahi hai.,0
MORLY/E/2023/9012345,"Mujhe ticket booking ke liye paise nahi mil rahe, kya karun?",0
MORLY/E/2023/0123456,"Staff se baat karne mein dikkat aa rahi hai, kuch nahi ho raha.",0
