registration_no,subject_content_text,dbscan_cluster
MORLY/E/2023/4567890,"Train ke staff ka behavior acha nahi tha, thoda rude lage.",0
MORLY/E/2023/5678901,"Mujhe ticket purchase karte waqt payment issue aa raha hai, help chahiye.",0
MORLY/E/2023/6789012,"Pehle se zyada delay hota hai trains ka, kuch karna chahiye.",-1
MORLY/E/2023/7890123,"Station ki facilities kaafi bekar hain, toilet bhi saaf nahi hote.",0
MORLY/E/2023/8901234,Train ke staff ne mujhe help nahi ki jab mujhe zarurat thi.,0
MORLY/E/2023/9012345,"Mujhe refund ke liye bahut waqt ho gaya, abhi tak nahi mila.",0
MORLY/E/2023/0123456,"Train ka time schedule bilkul galat hai, aap log theek karo.",0
MORLY/E/2023/1234568,"Station par koi bhi facilities nahi hain, kabhi bhi kuch nahi hota.",0
MORLY/E/2023/2345679,"Mujhe staff ka behavior kafi bura laga, thoda rude the.",0
MORLY/E/2023/3456780,"Payment ke liye maine jo details di thi, wo nahi mil rahi.",0
MORLY/E/2023/4567891,"Pehli baar travel kiya aur train ne 3 ghante delay kiya, bohot pareshani hui.",0
MORLY/E/2023/5678902,"Platform par kaafi gande conditions hain, kuch nahi karte aap log.",-1
MORLY/E/2023/6789013,"Staff ka attitude theek nahi tha, kuch zaroori information nahi di.",0
MORLY/E/2023/7890124,"Payment ka process sahi nahi chal raha hai, kaafi time ho gaya.",0
MORLY/E/2023/8901235,"Trains ka delay hona roz ka ho gaya hai, kuch solution hona chahiye.",-1
MORLY/E/2023/9012346,"Railway station par bahut jyada ganda hai, safai nahi hoti.",0
MORLY/E/2023/0123457,"Staff ne mujhe koi help nahi ki jab mujhe zarurat thi, bohot bura laga.",0
MORLY/E/2023/1234569,"Refund process ke liye maine kaafi baar contact kiya hai, abhi tak kuch nahi aaya.",0
MORLY/E/2023/2345670,"Train ka schedule bahut hi bekar hai, bhot time ho gaya waiting mein.",0
MORLY/E/2023/1234567,"Train ka time schedule consistent nahi hai, kabhi kabhi late hota hai.",0
MORLY/E/2023/2345678,Mera ticket cancel hone ke baad bhi paise nahi aaye. Bahut takleef ho rahi hai.,0
MORLY/E/2023/3456789,"Platform par safai nahi hoti, bahut gandh hai. Please check.",0
MORLY/E/2023/4567890,"Conductors bahut rude hain, koi help nahi karte.",0
MORLY/E/2023/5678901,"Train baar baar cancel ho rahi hai, koi plan nahi hai.",0
MORLY/E/2023/6789012,"Payment gateway issue hai, bar-bar fail ho raha hai.",0
MORLY/E/2023/7890123,"Waiting room ki cleanliness bahut kharab hai, please check.",0
MORLY/E/2023/8901234,"Staff se kuch nahi samajh aata, bahut confusing hai.",0
MORLY/E/2023/9012345,"Train timing kaafi inconsistent hai, please dekhiye.",0
MORLY/E/2023/0123456,"Refund milne mein bahut der ho rahi hai, please help.",0
MORLY/E/2023/1234567,"Station ki building ki halat bahut kharab hai, please dekhiye.",0
MORLY/E/2023/2345678,"Guard bahut rude hain, samasya nahi sunte.",0
MORLY/E/2023/3456789,"Train ki timing mein bahut delay hota hai, please check.",0
MORLY/E/2023/4567890,"Mera ticket cancel hone par refund nahi mil raha, bahut takleef hai.",0
MORLY/E/2023/5678901,"Station par lift kharab hai, bahut pareshaani ho rahi hai.",0
MORLY/E/2023/6789012,"Staff kuch nahi samajhte, bahut dikkat aa rahi hai.",0
MORLY/E/2023/7890123,"Train ka last minute change hota hai, please fix.",0
MORLY/E/2023/8901234,"Payment nahi ho raha, baar baar error aa raha hai.",0
MORLY/E/2023/1594823,"Yaar, meri train toh 2 ghante late aayi! Bahut pareshani hui. Kya yeh normal hai? Koi complaint kaise file karein?",0
MORLY/E/2023/4852013,"Mujhe apne ticket ka payment nahi mila! Maine pay kiya tha, but balance check karta hoon toh abhi bhi wahi hai. Please help!",0
MORLY/E/2023/2934018,Train ke staff ki attitude bilkul achi nahi thi! Unhone meri madad nahi ki jab mujhe zaroorat thi. Iske liye kya kar sakte hain?,0
MORLY/E/2023/8655202,Platform par bahut gande khudai hui hai. Yeh bahut khatarnak hai! Kisi bhi travel ke liye yeh jagah theek nahi hai!,0
MORLY/E/2023/9704219,Mujhe train ka schedule samajh nahi aa raha. Kaise check karu? Bahut dikkat ho rahi hai abhi.,0
MORLY/E/2023/1721430,Mujhe refund milne me bahut time ho gaya hai! Kya aap isko jaldi process kar sakte hain? I need my money back!,-1
MORLY/E/2023/4812094,Train ke guard ne mujhe koi jawab nahi diya jab maine madad maangi. Unka attitude bahut bura tha!,0
MORLY/E/2023/6729481,Station pe toilets bilkul gande hain. Koi safai nahi ho rahi hai! Yeh bahut problematic hai.,0
MORLY/E/2023/2581597,Maine apne ticket par galat seat assign hoti dekhi. Kya isko change kar sakte hain? Bahut pareshani ho rahi hai!,-1
MORLY/E/2023/6524210,Mujhe ticket ka payment confirm nahi hua hai jab maine online pay kiya. Please check karein!,0
MORLY/E/2023/7231084,Train ka staff bilkul bhi helpful nahi tha jab mujhe kuch madad chahiye thi. Yeh bahut disappointing hai!,0
MORLY/E/2023/7345100,"Station pe bahut saari jagah par khudai ho rahi hai, jo ki passengers ke liye problem hai. Kya isko theek kar sakte hain?",0
MORLY/E/2023/8293046,Mujhe train ki timing nahi samajh aa rahi. Kya koi help kar sakta hai? Bahut confusion hai!,0
MORLY/E/2023/3628901,Refund ka status check karne ki zaroorat hai. Kya aap mujhe bata sakte hain? Maine payment kiya tha.,0
MORLY/E/2023/5637890,"Train ke staff ne mujhe kuch nahi bataya jab maine poocha. Bahut takleef hui hai, please kuch karein!",-1
MORLY/E/2023/0743928,Station par parking ki koi vyavastha nahi hai. Bahut mushkil ho raha hai parking karna!,0
MORLY/E/2023/1985460,Train ka last minute change mujhe bahut pareshani de raha hai. Kya aap kuch kar sakte hain?,-1
MORLY/E/2023/6001857,"Maine refund ka request daala tha, lekin ab tak koi response nahi aaya! Kya aap check kar sakte hain?",0
MORLY/E/2023/9275406,Staff ne mujhe kuch nahi bataya jab maine unse kuch poocha. Yeh bilkul unacceptable hai!,-1
MORLY/E/2023/4820631,"Track ki maintenance bahut zaroori hai. Bahut saari jagah par khudai ho rahi hai, isme koi dikkat hai.",-1
MORLY/E/2023/2345678,"Train ki timing bahut galat hai. Humari train 2 ghante late hai, ye bahut pareshani hai.",0
MORLY/E/2023/3456789,"Mujhe refund nahi mila, maine ticket cancel kiya tha, par abhi tak kuch nahi hua.",0
MORLY/E/2023/4567890,"Railway staff ka behavior kaafi bekar hai, unhone mere saath bura vyavhar kiya.",-1
MORLY/E/2023/5678901,"Platform par safai nahi ho rahi hai, bahut gandh hai aur bheed bhi bahut hai.",0
MORLY/E/2023/6789012,"Train ki cleanliness bahut kharab hai, bahar se dekhne par bhi nahi lagta ki yeh rail hai.",0
MORLY/E/2023/7890123,"Mujhe ticket booking par paisa deduct hua, par ticket nahi mila. Kya hua?",0
MORLY/E/2023/8901234,"Station ke staff se baat karke mujhe koi madad nahi mili, unhone ignore kiya.",-1
MORLY/E/2023/9012345,"Railway station ki sadke bahut kharab hain, chalne me mushkil hoti hai.",0
MORLY/E/2023/0123456,"Train ka AC kaam nahi kar raha tha, bahut garmi thi, badi dikkat hui.",0
MORLY/E/2023/1234567,"Mera payment process nahi ho raha hai, baar baar error aa raha hai.",0
MORLY/E/2023/2345678,"Mujhe koi help nahi mil rahi hai, staff puchne par bhi jawab nahi dete.",0
MORLY/E/2023/3456789,"Station ke restroom ki safai bahut kharab hai, use nahi kar sakte.",0
MORLY/E/2023/4567890,Train ka ticket cancel hone par abhi tak refund nahi mila.,0
MORLY/E/2023/5678901,"Mera ticket cancel hone ke baad refund nahi mila, bahut samay ho gaya.",0
MORLY/E/2023/6789012,"Railway staff ne meri madad nahi ki, baat karte waqt unhone mujhe ignore kiya.",0
MORLY/E/2023/7890123,"Railway station par infrastructure bahut kharab hai, bahut dikkat hoti hai.",0
MORLY/E/2023/8901233,"Train ki safety ko lekar mujhe chinta hai, kuch incidents hue hain.",-1
MORLY/E/2023/1234569,"Mujhe refund nahi mil raha hai, maine cancel kiya tha par ab tak kuch nahi aaya.",0
MORLY/E/2023/1234567,"Train ka schedule bahut hi late ho gaya hai, 3 ghante se intezaar kar raha hoon. Kya issue hai?",0
MORLY/E/2023/2345678,"Payment ke liye card use kiya tha, par amount nahi deduct hua. Help karein!",0
MORLY/E/2023/3456789,Clerk ne mera kaam nahi kiya aur rude raha. Yeh unacceptable hai!,0
MORLY/E/2023/4567890,"Platform par bahut gande conditions hain, kya inka dhyan nahi diya jata?",0
MORLY/E/2023/5678901,"Train me koi facilities nahi thi, khana nahi mil raha tha, bahut dikkat hui.",0
MORLY/E/2023/6789012,Maine ticket book kiya par confirmation nahi aaya. Kya ho raha hai?,0
MORLY/E/2023/7890123,"Staff ne mere luggage ko sahi se handle nahi kiya, bahut bekaar experience tha.",-1
MORLY/E/2023/8901234,"Platform bahut purana ho gaya hai, repair ki zarurat hai. Kya plan hai?",0
MORLY/E/2023/9012345,"Train on-time nahi aayi, bahut late ho gaya tha. Please dekhein.",0
MORLY/E/2023/0123456,"Mera refund ab tak nahi aaya, 3 baar call kiya, kuch nahi hua!",0
MORLY/E/2023/1234568,"Staff ne badi galti ki, mera ticket cancel kiya bina mujhe bataye. Bahut gussa aa raha hai.",-1
MORLY/E/2023/2345679,"Station ki safai nahi ho rahi hai, bahut ganda hai. Yeh koi dhyaan nahi de raha?",0
MORLY/E/2023/3456780,Train delay hone par koi information nahi mili. Communication behtar hona chahiye.,0
MORLY/E/2023/4567891,Mujhe payment ka issue hai aur customer service bhi kuch nahi kar rahi hai.,0
MORLY/E/2023/5678902,Staff se baat karne par koi help nahi hui. Bahut dikkat hui!,0
MORLY/E/2023/6789013,"Station ki building ki condition bahut kharab hai, please kuch karein.",0
MORLY/E/2023/7890124,Train ka route badal diya gaya bina kisi information ke. Bahut dikkat hui.,0
MORLY/E/2023/8901235,"Mujhe payment ka issue hai. Ticket ka paise nahi aa raha, madad karein.",0
MORLY/E/2023/9012346,"Staff ne mujhe samajhne mein fail raha, koi clarity nahi di. Bahut dikkat hui.",0
MORLY/E/2023/0123457,"Station par koi facilities nahi hain, bahut problem ho rahi hai. Help karein.",0
MORLY/E/2023/6543210,Mere train ka schedule bahut late hai. Pata nahi kya problem hai. Kafi passengers ko dikkat ho rahi hai.,0
MORLY/E/2023/7654321,"Mujhe apne ticket ka refund nahi mil raha hai. Mere account ka number X0X5X hai, please check karein.",0
MORLY/E/2023/8765432,Kuch staff log bahut rude hain aur madad nahi karte. Unhe training ki zarurat hai.,0
MORLY/E/2023/9876543,"Platform par safai nahi hoti, aur kuch jagah par chhatri nahi hain. Bahut dikkat hoti hai.",0
MORLY/E/2023/1234567,Train ke time par nahi aane se mujhe bahut pareshaani hoti hai. Kya isko sudhara ja sakta hai?,-1
MORLY/E/2023/2345678,"Refund ka process bahut slow hai. Mere account number X0X7X hai, jaldi karein.",0
MORLY/E/2023/3456789,"Kuch platforms par lights nahi hain, andhera hota hai. Suraksha ke liye yeh bahut zaruri hai.",0
MORLY/E/2023/4567890,Kuch railway staff log bhasha samajhne mein dikkat karte hain. Yeh badalna chahiye.,-1
MORLY/E/2023/5678901,"Train ka schedule pichle kuch dinon se theek nahi hai, samasya kya hai?",0
MORLY/E/2023/6789012,"Mujhe apne ticket ka refund nahi mil raha hai, account number X0X8X hai. Jaldi dekhein.",0
MORLY/E/2023/7890123,"Station par benches nahi hain, bahut mushkil hota hai intezaar karna. Yeh sudharna chahiye.",0
MORLY/E/2023/8901234,"Mujhe train ka ticket nahi mil raha hai, mujhe bahut dikkat ho rahi hai.",0
MORLY/E/2023/0123456,"Kuch logon ka behavior theek nahi hai, unhe training ki zarurat hai.",0
MORLY/E/2023/1234567,"Mujhe refund nahi mil raha hai, mere account ka number X0X9X hai. Jaldi dekhein.",0
MORLY/E/2023/2345678,"Station ki safai bahut kharab hai, kya yeh sudhar sakte hain?",0
MORLY/E/2023/3456789,"Train time se nahi aati hai, hamesha der hoti hai. Iska kya hoga?",0
MORLY/E/2023/4567890,"Kuch railway staff logon ka behavior accha nahi hai, is par dhyan de.",0
MORLY/E/2023/5678901,"Station ki suraksha bahut kharab hai, kuch aur logon ko dekhne ki zarurat hai.",0
MORLY/E/2023/6789013,"Mera refund ab tak nahi aaya, mujhe bahut pareshaani ho rahi hai. Account number X0X4X hai.",0
MORLY/E/2023/8901235,Train ka schedule kab se sudhrega? Bahut der ho raha hai.,0
MORLY/E/2023/4567890,Train ka time har baar late hota hai. Mujhe office time par pahunchna hai. Kya kuch nahi kiya ja sakta?,0
MORLY/E/2023/7890123,Mujhe PNR no. X123X ke liye refund nahi mila hai. Kya aap check kar sakte hain?,0
MORLY/E/2023/8901234,"Station par staff bahut rude hain. Aisa nahi hona chahiye, hum sab passengers hain.",0
MORLY/E/2023/9012345,Platform pe safai nahi ki ja rahi hai. Bahut gandh aa raha hai. Iska kya hoga?,0
MORLY/E/2023/0123456,Mujhe train ki connectivity se dikkat ho rahi hai. Akele aur waqt pe nahi pahuch paa raha hoon.,0
MORLY/E/2023/1234562,Mujhe PNR no. X234X ke liye paisa nahi mila. Iska kya haal hai?,0
MORLY/E/2023/2345678,Train staff ne mujhse accha vyavhaar nahi kiya. Ye nahi hona chahiye.,0
MORLY/E/2023/3456789,Railway station par toilets ki safai nahi ho rahi hai. Ye bahut zaroori hai.,0
MORLY/E/2023/4567890,Train ke schedule bahut bekar hai. Har baar delay hota hai. Iska kya hoga?,0
MORLY/E/2023/5678901,Mujhe ticket refund ka paise nahi mila hai. PNR X567X hai.,0
MORLY/E/2023/6789012,Train staff ka vyavhaar theek nahi hai. Ye bilkul bhi sahi nahi hai.,0
MORLY/E/2023/7890123,Station par bahut saari pareshaniyan hain. Washrooms aur lifts kharab hain.,0
MORLY/E/2023/8901234,Train ki timings bahut hi bekar hain. Isko sudharne ki zarurat hai.,0
MORLY/E/2023/0123455,PNR X678X ke liye refund nahi mila hai. Iska kya hua?,0
MORLY/E/2023/1234567,"Staff ka vyavhaar theek nahi hai, unhe training ki zarurat hai.",0
MORLY/E/2023/2345670,Station ki cleanliness bahut kharab hai. Is par dhyan dena zaruri hai.,0
MORLY/E/2023/3456781,"Train ka time schedule bahut kharab hai, mujhe bahut dikkat ho rahi hai.",0
MORLY/E/2023/4567890,"PNR X890X ka refund nahi mila hai, isko check kar lo.",0
MORLY/E/2023/1234567,Mujhe train ke delay ki wajah se mushkil hui hai. Please help!,0
MORLY/E/2023/2345678,"Mera ticket cancellation ka refund nahi aaya, help karo.",0
MORLY/E/2023/3456789,"Railway staff rude behave kar rahe the, please investigate.",0
MORLY/E/2023/4567890,"Platform pe safai nahi hai, bahut gandh hai, kuch karo.",0
MORLY/E/2023/5678901,"Train time pe nahi aa rahi hai, bahut pareshani ho rahi hai.",0
MORLY/E/2023/6789012,"Mujhe extra charge lag gaye hain, please check my payment.",0
MORLY/E/2023/7890123,"Staff ki training acchi nahi hai, unhe aur training ki zarurat hai.",0
MORLY/E/2023/8901234,"Station ki building bahut purani hai, please renovate kare.",0
MORLY/E/2023/9012345,"Train ka route change ho gaya hai, ye pehle se inform nahi kiya gaya.",0
MORLY/E/2023/0123456,"Mera payment pending hai, please check karein.",0
MORLY/E/2023/1234568,"Train attendants ki service achi nahi hai, kuch karo.",0
MORLY/E/2023/2345679,"Station ki safai bahut kharab hai, please dhyan dein.",0
MORLY/E/2023/3456780,"Train mein seat nahi mil rahi, please help!",0
MORLY/E/2023/4567891,"Mera payment nahi aaya, main kaise travel karu?",0
MORLY/E/2023/5678902,"Staff se baat karne ka tareeka sahi nahi hai, please check.",0
MORLY/E/2023/6789013,"Platform ka structure kharab ho gaya hai, kuch karo.",0
MORLY/E/2023/7890124,"Train ka schedule theek nahi hai, please thoda improve karein.",0
MORLY/E/2023/8901235,"Mera ticket payment issue hai, kuch help kare.",0
MORLY/E/2023/9012346,"Staff ne mujhe help nahi ki, bhale bhale waise nahi hone chahiye.",0
MORLY/E/2023/0123457,"Station ki building kaafi purani hai, isko thoda renovate karein.",0
MORLY/E/2023/1423587,"Train late ho rahi hai, mujhe bahut pareshaani ho rahi hai. Kya koi update hai?",0
MORLY/E/2023/9435678,"Mujhe payment issue aa raha hai, mera transaction successful nahi ho raha hai.",0
MORLY/E/2023/6543210,"Platforms mein bahut gande hain, saaf safai nahi ho rahi hai. Yeh bahut galat hai.",0
MORLY/E/2023/7896543,"Staff bahut rude hain, unhe training ki zarurat hai. Koi complaint register karna chahungi.",0
MORLY/E/2023/1234567,"Kuch trains time par nahi aa rahi hain, logon ko dikkat ho rahi hai. Iska kya hoga?",0
MORLY/E/2023/2468135,"Mera refund process nahi ho raha hai, please madad karein.",0
MORLY/E/2023/1357924,"Railway station ki building bahut purani hai, renovation ki zarurat hai. Kya kuch ho raha hai iske liye?",0
MORLY/E/2023/5678901,"Employees ka behavior bahut kharab hai, unki training zaruri hai. Is par dhyaan dena chahiye.",0
MORLY/E/2023/9081723,"Train ki frequency bahut kam hai, kya kuch kiya ja raha hai is par?",0
MORLY/E/2023/4567890,"Payment confirm nahi ho raha hai, bahut pareshaani ho rahi hai.",0
MORLY/E/2023/7891234,Railway station ki cleanliness bahut kharab hai. Aapko is par dhyaan dena chahiye.,0
MORLY/E/2023/3214567,"Staff kabhi kabhi madad nahi karte, humein bahut dikkat hoti hai. Is par kya kuch kiya ja raha hai?",0
MORLY/E/2023/2345678,"Time table kaafi confusing hai, kya isko theek kiya ja sakta hai?",0
MORLY/E/2023/9876543,"Mujhe payment nahi mili hai, maine ticket li thi. Is par kya action ho raha hai?",0
MORLY/E/2023/2468901,"Station pe koi facilities nahi hain, bahut mushkil hoti hai. Aise nahi chalega.",0
MORLY/E/2023/1597534,"Staff ki training bilkul nahi hui, unhe professional behavior sikhana hoga.",0
MORLY/E/2023/3456789,"Train ka time schedule bahut galat hai, kabhi kabhi aata hai late aur kabhi pehle chali jaati hai.",0
MORLY/E/2023/1234560,"Payment ka amount mere account mein nahi aaya hai, please check karo.",0
MORLY/E/2023/2345678,"Railway ke staff ka behavior bahut rude hai, is par action lena chahiye.",0
MORLY/E/2023/9876542,"Station ki cleanliness bahut kharab hai, restroom bhi gande hain.",0
MORLY/E/2023/8765431,"Train hamesha late hoti hai, is par kya action liya jaa raha hai?",0
MORLY/E/2023/7654320,"Mere ticket ka paisa refund nahi hua hai, please check karein.",0
MORLY/E/2023/6543219,"Railway ke personnel ka behavior achha nahi hai, unko training chahiye.",-1
MORLY/E/2023/5432108,"Station par facilities bahut kharab hain, washrooms bhi gande hain.",0
MORLY/E/2023/4321097,"Train ka coach bahut dirty hai, iski safai nahi hui hai.",0
MORLY/E/2023/3210986,"Mera ticket ka paisa ab tak nahi aaya, aap log kya kar rahe hain?",0
MORLY/E/2023/2109875,"Railway staff se baat karna mushkil hota hai, response nahi milta.",0
MORLY/E/2023/1098764,"Platform par seating arrangement theek nahi hai, bahut dikkat hoti hai.",0
MORLY/E/2023/0987653,"Train ke timings kaafi badal gaye hain, is par kuch nahi hota.",0
MORLY/E/2023/8765432,"Mujhe refund nahi mila hai, kya aap meri madad kar sakte hain?",0
MORLY/E/2023/7654321,"Mujhe kisi staff ne ghalat jawab diya, please dekhiye.",-1
MORLY/E/2023/6543210,"Platform par lights nahi hai, raat ko bahut dikkat hoti hai.",0
MORLY/E/2023/5432109,"Mujhe train ka schedule nahi samajh aata, kya aap madad kar sakte hain?",-1
MORLY/E/2023/2109876,"Mujhe refund process ko lekar dikkat ho rahi hai, help karein.",0
MORLY/E/2023/3210987,"Staff ka behavior bahut kuchh bekar hai, aap log kuch kar sakte hain?",0
MORLY/E/2023/2109878,"Platform par potholes hain, bahut dikkat hoti hai.",0
MORLY/E/2023/1234567,Train ka time schedule bahut hi kharab hai. Har baar der se aati hai aur humari plans bigad deti hai.,0
MORLY/E/2023/2345678,Maine ek ticket ke liye payment kiya tha lekin mujhe confirmation nahi mila. Yeh bahut samasya hai.,0
MORLY/E/2023/3456789,Railway staff ki customer service bahut bekar hai. Unka behavior bhi theek nahi hai.,0
MORLY/E/2023/4567890,Station par facilities bahut kharab hain. Toilets aur waiting area mein problems hain.,0
MORLY/E/2023/5678901,"Train ko late karne ka koi reason nahi diya gaya. Aisa hona nahi chahiye, please is par dhyaan dein.",0
MORLY/E/2023/6789012,Payment karne par mujhe koi confirmation nahi mila. Bahut samasya ho rahi hai.,0
MORLY/E/2023/7890123,"Railway personnel ki training bahut zaroori hai. Unka behavior theek nahi hai, is par dhyaan dein.",-1
MORLY/E/2023/8901234,Station ki cleanliness aur facilities bahut kharab hain. Aapko is par dhyaan dena chahiye.,0
MORLY/E/2023/9012345,Train ka service bahut kharab hai. Aakaar se der se aana aur jaana ho raha hai. Is par dhyaan dena chahiye.,0
MORLY/E/2023/0123456,Mujhe booking ke time payment nahi mil raha hai. Bahut badi samasya hai.,0
MORLY/E/2023/1230987,Railway staff ko training ki bahut zarurat hai. Unka behavior kabhi kabhi theek nahi hota.,0
MORLY/E/2023/2340987,Station ki cleanliness aur security mein bahut kami hai. Is par turant dhyaan dena chahiye.,0
MORLY/E/2023/3450987,Train service ki quality bahut kharab hai. Is par dhyaan dena hoga.,0
MORLY/E/2023/4560987,Maine ticket book kiya tha lekin payment nahi ho raha tha. Bahut badi samasya ho rahi hai.,0
MORLY/E/2023/5670987,Railway staff ko jyada training ki zarurat hai. Unka behavior kabhi kabhi theek nahi hota.,0
MORLY/E/2023/6780987,Station ki facilities bahut kharab hain. Toilets aur waiting area mein problems hain.,0
MORLY/E/2023/7890987,Train ka service bahut bekar hai. Har baar der se aati hai.,0
MORLY/E/2023/8900987,Mujhe ticket ke liye payment nahi mil raha tha. Bahut time lag raha hai.,0
MORLY/E/2023/9010987,Railway staff ki training zaruri hai. Unka behavior theek nahi hai.,0
MORLY/E/2023/1234567,"Train ka schedule baar baar badal raha hai, samay par nahi chal rahi hai.",0
MORLY/E/2023/2345678,"Mera refund ab tak nahi aaya hai, booking ID kya hai, samjhiye.",0
MORLY/E/2023/3456789,"Guard sahab ki madad nahi mil rahi hai, kuch nahi kar rahe hain.",0
MORLY/E/2023/4567890,"Platform bahut kharab hai, safai nahi hoti, khud ko khud sambhalna pada.",0
MORLY/E/2023/5678901,"Train delay hone se bada parishan ho gaya hoon, kaam khatam nahi ho raha.",-1
MORLY/E/2023/6789012,"Mera payment nahi hua hai, kis prakar ka issue hai mujhe samjhaiye.",0
MORLY/E/2023/7890123,"Railway staff bahut rude hain, kuch nahi samajhte hain.",0
MORLY/E/2023/8901234,"Station ki building bahut purani hai, repair ki zarurat hai.",0
MORLY/E/2023/9012345,"Train ka time bahut odd hai, samay par nahi milta.",0
MORLY/E/2023/0123456,"Maine ticket book kiya tha, par card charge nahi hua hai.",0
MORLY/E/2023/1234568,Railway staff aksar samasya ko samajh nahi paa rahe hain.,0
MORLY/E/2023/2345679,"Station par safai nahi hoti, badi samasya ho gayi hai.",0
MORLY/E/2023/3456790,"Train ko time pe nahi chhod rahe hain, baithne ki jagah nahi mil rahi.",0
MORLY/E/2023/4567891,"Refund ka case maine daala tha, ab tak koi response nahi aaya.",0
MORLY/E/2023/5678902,"Railway staff aaj kal bilkul madad nahi kar rahe hain, samasya hai.",0
MORLY/E/2023/6789013,"Station ki building bahut kharab halat mein hai, turant kuch karna chahiye.",0
MORLY/E/2023/7890124,"Train ki cleanliness bahut kharab hai, koi safai nahi kar raha.",0
MORLY/E/2023/8901235,"Mera payment confirm nahi hua hai, kahan hai mera paisa?",0
MORLY/E/2023/6574321,Mujhe train ke delay ki wajah se bahut dikkat hui. Pichle 2 mahine se baar baar ho raha hai!,0
MORLY/E/2023/8912345,Mujhe payment gateway mein problem aayi hai. Mere paise deduct ho gaye par ticket nahi mili.,0
MORLY/E/2023/3456789,Railway staff ke behavior kaafi kharab hai. Unhone mujhe theek se help nahi kiya.,0
MORLY/E/2023/7891234,Station par washroom ki safai bahut kharab hai. Koi bhi dhyaan nahi deta.,0
MORLY/E/2023/1234567,Train ka schedule har baar change hota hai. Is wajah se mujhe kaafi problem hoti hai.,0
MORLY/E/2023/2345678,Mere account se paise nahi aaye. Ticket confirm nahi hui hai. Yeh kya ho raha hai?,0
MORLY/E/2023/4567890,Ticket booking ke dauran staff ka behavior bahut bura tha. Mujhe koi madad nahi mili.,0
MORLY/E/2023/6789012,"Station par safai bohot kharab hai. Kahi bhi safai nahi hai, mehsoos hota hai ki koi dikhta hi nahi.",0
MORLY/E/2023/7890123,Train baar baar cancel ho ja rahi hai aur mujhe safar karne mein problem ho rahi hai.,0
MORLY/E/2023/8901234,Mere payment ke liye koi confirmation nahi aayi. Mere paise ka kya hoga?,0
MORLY/E/2023/9012345,Kuch staff members kaafi rude hain. Unhone meri complaint ko seriously nahi liya.,-1
MORLY/E/2023/0123456,Station ki building ki condition acchi nahi hai. Bahar se dekhne par bilkul hi bura lagta hai.,-1
MORLY/E/2023/1234560,Train ki timing kabhi bhi sahi nahi hoti. Is wajah se meri meetings miss ho ja rahi hain.,0
MORLY/E/2023/2345671,Mujhe payment ka confirmation nahi mila. Mere paise ka kya hoga?,0
MORLY/E/2023/3456782,Staff ki attitude bahut kharab hai. Unhone meri madad nahi ki.,0
MORLY/E/2023/4567893,Railway stations par infrastructure bilkul theek nahi hai. Ye dekhna bahut zaroori hai.,0
MORLY/E/2023/5678904,Mujhe train ki booking mein bahut dikkat ho rahi hai. Koi help nahi kar raha.,0
MORLY/E/2023/2345678,"Train time table sahi nahi hai, pichle 2 hafte se delay ho raha hai. Koi solution nahi mil raha hai.",0
MORLY/E/2023/3456789,"Maine ticket book kiya tha, lekin payment nahi hui. Paisa wapas nahi hua ab tak.",0
MORLY/E/2023/4567890,"Train service kaafi bekar hai. Bahut late hota hai, staff bhi cooperate nahi karta.",0
MORLY/E/2023/5678901,"Platform ki safai bahut kharab hai. Kahi bhi khudai chali hui hai, koi dhyan nahi de raha.",0
MORLY/E/2023/6789012,"Staff ka behavior aaj kal acha nahi hai. Kisi ko kuch help nahi karte, rude hain sab.",0
MORLY/E/2023/7890123,"Trains ka time schedule bilkul sahi nahi hai. 2 ghante late ho raha hai, koi notice nahi hai.",0
MORLY/E/2023/8901234,Payment nahi ho raha hai. Koi error aa raha hai jab mai card use karta hu.,0
MORLY/E/2023/9012345,"Railway stations ki safai bahut kharab hai. Kahi bhi kachra pada hai, koi dhyan nahi de raha.",0
MORLY/E/2023/0123456,Staff ka attitude thoda behtar hona chahiye. Bahut rude hain wo log.,-1
MORLY/E/2023/1234567,"Train punctuality bahut kharab hai. Har baar late hoti hai, bahut pareshani hoti hai.",0
MORLY/E/2023/2345679,"Mujhe refund nahi mila hai. Main ne ticket cancel kiya tha, lekin paisa nahi wapas aaya.",0
MORLY/E/2023/3456780,"Railway station par bahut badi samasya hai. Infrastructure theek nahi hai, bahut pareshani hoti hai.",0
MORLY/E/2023/4567891,Station par staff se achhi service milni chahiye. Kahi baar koi madad nahi karta.,-1
MORLY/E/2023/5678902,"Train delay bahut zyada ho raha hai, koi bhi samadhan nahi mil raha hai.",0
MORLY/E/2023/6789013,"Ticket cancel kiya tha, lekin refund kab aayega, koi pata nahi.",0
MORLY/E/2023/7890124,"Station ki building purani ho gayi hai, thoda renovation hona chahiye.",0
