registration_no,subject_content_text,cleaned_text,agg_cluster
MORLY/E/2023/1234567,Payment ka issue aaya hai. Mere account se paise gaya par ticket nahi mili.,payment issue account paise ticket nahi mili,1456
MORLY/E/2023/2345678,"Station par safai nahi hai. Bahut ganda ho gaya hai, please dhyan dein.",station safai nahi bahut ganda dhyan dein,166
MORLY/E/2023/3456789,Train late ho rahi hai aur koi information nahi mil rahi. Kya ho raha hai?,train late information nahi mil,1297
MORLY/E/2023/4567890,Train ke staff ka behavior badhiya nahi tha. Kya yeh samasya solve karenge?,train staff behavior badhiya nahi samasya solve karenge,1088
MORLY/E/2023/5678901,"Pichli baar ka experience bahut kharab tha, please is baar theek karein.",pichli baar experience bahut kharab baar theek,145
MORLY/E/2023/6789012,"Mujhe refund nahi mila, ticket cancellation ke liye paise wapas nahi aaye.",refund nahi mila ticket cancellation paise wapas nahi aaye,640
MORLY/E/2023/7890123,"Platform bahut kharab halat mein hai, koi bhi dhyan nahi de raha.",platform bahut kharab halat dhyan nahi,328
MORLY/E/2023/8901234,"Train ka schedule change ho gaya hai, mujhe koi notification nahi mila.",train schedule change notification nahi mila,713
MORLY/E/2023/9012345,Kya staff ko train ki info nahi hoti? Bahut confusion hota hai.,staff train info nahi bahut confusion,574
MORLY/E/2023/0123456,Railway station ka bathroom behtar hona chahiye. Bahut ganda hai.,railway station bathroom behtar chahiye bahut ganda,1834
MORLY/E/2023/1234560,"Mujhe koi message nahi aaya refund ke liye, please dekhein.",message nahi refund dekhein,1985
MORLY/E/2023/2345601,"Train ke timings har baar change hote hain, bhut dikkat hoti hai.",train timings har baar change bhut dikkat,1010
MORLY/E/2023/3456012,"Railway station par parking ki kami hai, please kuch karein.",railway station parking kami,934
MORLY/E/2023/4560123,"Staff ki training thik se nahi ho rahi, customer service kharab hai.",staff training thik nahi customer service kharab,115
MORLY/E/2023/5601234,"Kahi baar payment ho jata hai, par ticket nahi milti. Yeh kya hai?",kahi baar payment jata ticket nahi milti,1190
MORLY/E/2023/6012345,Station ki building ka condition achha nahi hai. Kya kuch kiya jayega?,station building condition achha nahi jayega,1740
MORLY/E/2023/7123456,"Train puri nahi aayi, kya aap log kuch nahi kar sakte?",train puri nahi log nahi sakte,495
MORLY/E/2023/1234567,"Train ka timing bilkul galat hai, baar baar late ho jaata hai.",train timing galat baar baar late jaata,944
MORLY/E/2023/7654321,"Mera ticket ka paisa refund nahi hua hai, please help!",ticket paisa refund nahi,791
MORLY/E/2023/2345678,"Railway station pe safai nahi hai, bahut ganda hai.",railway station safai nahi bahut ganda,410
MORLY/E/2023/3456789,"Staff ki training achi nahi hai, rude behavior hai.",staff training achi nahi rude behavior,257
MORLY/E/2023/4567890,"Train ka schedule bilkul adhere nahi ho raha hai, bahut pareshani ho rahi hai.",train schedule adhere nahi bahut pareshani,524
MORLY/E/2023/5678901,"Mera ticket confirmation nahi hua, paise toh debit ho gaye.",ticket confirmation nahi paise debit,936
MORLY/E/2023/6789012,Platform pe kisi bhi tarah ka safety arrangement nahi hai!,platform kisi tarah safety arrangement nahi,1416
MORLY/E/2023/7890123,"Konductors ka behaviour acha nahi hai, bahut rude hain.",konductors behaviour acha nahi bahut rude,82
MORLY/E/2023/8901234,"Mujhe train chhodna pada, kyunki timing thik nahi tha.",train chhodna pada kyunki timing thik nahi,537
MORLY/E/2023/9012345,"Mera refund ab tak nahi aaya hai, bahut pareshaan hoon.",refund nahi bahut pareshaan,68
MORLY/E/2023/0123456,"Railway station pe elevators kharab hain, please fix them.",railway station elevators kharab fix,629
MORLY/E/2023/1234560,"Conductor ne mujhe andhere mein chhod diya, please dekhiye isse.",conductor andhere chhod dekhiye isse,1777
MORLY/E/2023/2345698,"Train ko miss kar diya, kyunki baithne ki jagah nahi mili.",train miss kyunki baithne jagah nahi mili,245
MORLY/E/2023/3456781,"Mere credit card se payment nahi ho raha hai, please madad karein.",credit card payment nahi,307
MORLY/E/2023/4567892,"Station pe toilets bahut gande hain, please clean them.",station toilets bahut gande clean,744
MORLY/E/2023/5678903,"Staff ka behavior bahut kharab hai, mujhe samasya hui.",staff behavior bahut kharab samasya,355
MORLY/E/2023/6789014,"Train bahut late aa raha hai, koi bhi information nahi hai.",train bahut late information nahi,573
MORLY/E/2023/7890125,"Mujhe payment ka confirmation nahi mila hai, please dekhiye.",payment confirmation nahi mila dekhiye,270
MORLY/E/2023/8901236,"Station ke paas parking facilities nahi hai, please improve.",station paas parking facilities nahi improve,1057
MORLY/E/2023/9012347,"Staff ne mujhe jhoot bola, bahut bura laga.",staff jhoot bola bahut bura laga,119
MORLY/E/2023/9876543,"Train ka schedule bahut late ho raha hai. Muje samay par pahunchna hai, please kuch karein!",train schedule bahut late muje samay pahunchna,1036
MORLY/E/2023/1234567,"Mere ticket ki payment abhi tak nahi hui hai, please dekhain! Transaction ID: XXXXXX.",ticket payment abhi nahi dekhain transaction xxxxxx,358
MORLY/E/2023/2345678,"Train ke staff ne mere saath achha vyavhaar nahi kiya, please unhe samjhaein!",train staff saath achha vyavhaar nahi samjhaein,1295
MORLY/E/2023/3456789,"Platform bahut kharab haalat mein hai, kuch karna padega!",platform bahut kharab haalat padega,1327
MORLY/E/2023/4567890,"Mujhe train ki timing ki jankari nahi mil rahi, bahut parishani ho rahi hai!",train timing jankari nahi mil bahut parishani,1089
MORLY/E/2023/5678901,"Mujhe refund nahi mila, please dekhein! Transaction ID: XXXXXX.",refund nahi mila dekhein transaction xxxxxx,298
MORLY/E/2023/6789012,"Train staff ki taraf se service kafi bekar thi, main bahut naraaz hoon.",train staff taraf service kafi bekar main bahut naraaz,1164
MORLY/E/2023/7890123,"Railway station ka infrastructure bahut kharab hai, kuch nahi kiya ja raha.",railway station infrastructure bahut kharab nahi,428
MORLY/E/2023/8901234,"Train ki haalat kharab hai, please ispe action lein!",train haalat kharab ispe action lein,140
MORLY/E/2023/9012345,"Mujhe ticket cancel karne par refund nahi mila hai, please dekhein!",ticket cancel refund nahi mila dekhein,136
MORLY/E/2023/0123456,"Mere saath staff ne achhe se baat nahi ki, mujhe samasya hui.",saath staff achhe baat nahi samasya,263
MORLY/E/2023/1234568,"Station ke washroom bahut gande hain, inka dhyan rakhein.",station washroom bahut gande inka dhyan rakhein,342
MORLY/E/2023/2345679,"Mere train ki reservation nahi hui hai, please madad kare!",train reservation nahi kare,491
MORLY/E/2023/3456780,"Mujhe ticket ki payment nahi hui, please dekhein! Transaction ID: XXXX.",ticket payment nahi dekhein transaction xxxx,580
MORLY/E/2023/4567891,"Train staff ka vyavhaar bilkul theek nahi tha, please kuch karein.",train staff vyavhaar theek nahi,104
MORLY/E/2023/5678902,"Station par bahut saari facilities nahi hain, please kuch karein.",station bahut saari facilities nahi,953
MORLY/E/2023/6789013,"Train ka service bilkul sahi nahi hai, bahut dikkat ho rahi hai!",train service sahi nahi bahut dikkat,885
MORLY/E/2023/7890124,"Mujhe payment nahi mili, transaction ID: XXXXXX, please dekh le!",payment nahi mili transaction xxxxxx dekh,1471
MORLY/E/2023/8901235,"Staff ne mujhe assist nahi kiya, bahut takleef hui.",staff assist nahi bahut takleef,319
MORLY/E/2023/1234567,"Train ka schedule baar-baar badal raha hai, isse humein dikkat ho rahi hai. Humein ek fix time chahiye.",train schedule baarbaar badal isse dikkat fix time chahiye,1381
MORLY/E/2023/2345678,Mujhe ticket ke liye payment karne ke baad confirmation nahi mila. Mere paise wapas kahan hain?,ticket payment baad confirmation nahi mila paise wapas,348
MORLY/E/2023/3456789,Mujhe train ke staff ki taraf se bura vyavhaar mila. Kya iske liye kuch kiya ja sakta hai?,train staff taraf bura vyavhaar mila iske sakta,1410
MORLY/E/2023/4567890,"Platform ki sthiti bahut kharab hai, logon ko dikkat hoti hai. Iska kuch samadhan chahiye.",platform sthiti bahut kharab logon dikkat samadhan chahiye,1800
MORLY/E/2023/5678901,Train ke delays ke wajah se students ko school pahunchne mein mushkil ho rahi hai. Iska kuch kiya jaaye.,train delays wajah students school pahunchne mushkil jaaye,1915
MORLY/E/2023/6789012,Mujhse ticket ka paisa kat gaya par confirmation nahi mila. Kya aap meri madad kar sakte hain?,mujhse ticket paisa kat confirmation nahi mila sakte,215
MORLY/E/2023/7890123,Railway ke staff se bura vyavhaar mila. Is par kuch kadam uthaye ja sakte hain?,railway staff bura vyavhaar mila kadam uthaye sakte,858
MORLY/E/2023/8901234,"Railway ka bridge bahut purana ho gaya hai, iski marammat ki bahut zaroorat hai.",railway bridge bahut purana iski marammat bahut zaroorat,641
MORLY/E/2023/9012345,"Train ka time schedule sahi nahi hai, iski wajah se humein kaafi dikkat ho rahi hai.",train time schedule sahi nahi iski wajah dikkat,538
MORLY/E/2023/0123456,"Maine online ticket ke liye payment kiya, lekin kuch nahi hua. Mujhe madad chahiye.",online ticket payment nahi chahiye,520
MORLY/E/2023/1234568,"Train ke staff ka vyavhaar achha nahi tha, is par kuch karwai honi chahiye.",train staff vyavhaar achha nahi karwai honi chahiye,527
MORLY/E/2023/2345679,"Railway station par restroom ki sthiti bahut kharab hai, uska sudhar hona chahiye.",railway station restroom sthiti bahut kharab sudhar chahiye,1200
MORLY/E/2023/3456780,"Train ke operations mein bahut dikkat ho rahi hai, is par kuch kiya jaye.",train operations bahut dikkat jaye,1873
MORLY/E/2023/4567891,"Mere payment ke liye refund nahi aaya, kya aap meri madad kar sakte hain?",payment refund nahi sakte,883
MORLY/E/2023/5678902,Mujhe railway staff ka vyavhaar samajh nahi aaya. Kya iske liye aap kuch kar sakte hain?,railway staff vyavhaar samajh nahi iske sakte,170
MORLY/E/2023/6789013,Station ki safai bahut kharab hai. Is par kuch dhyan diya jaye.,station safai bahut kharab dhyan jaye,241
MORLY/E/2023/7890124,"Railway services mein kai dikkat hai, ye dekha jaye. Bahut se log pareshaan hain.",railway services kai dikkat dekha jaye bahut log pareshaan,1437
MORLY/E/2023/8901235,"Mere payment ka refund nahi aaya hai, kya yeh jaldi ho sakta hai?",payment refund nahi jaldi sakta,680
MORLY/E/2023/9012346,"Mujhe railway staff ka vyavhaar bilkul theek nahi laga, kya yeh dekha ja sakta hai?",railway staff vyavhaar theek nahi laga dekha sakta,104
MORLY/E/2023/2345678,Train ka time hamesha late hota hai. Aaj bhi 2 ghante late hai. Kya kar rahe ho aap log?,train time hamesha late aaj ghante late log,165
MORLY/E/2023/3456789,Mere ticket ki payment nahi hui. Account number XXXXXX1234 hai. Jaldi dekhiye.,ticket payment nahi account number xxxxxx jaldi dekhiye,261
MORLY/E/2023/4567890,Station par safai nahi hai. Khud dekhiye kabhi! Badi dikkat hoti hai.,station safai nahi khud dekhiye badi dikkat,1265
MORLY/E/2023/5678901,Staff rude hai. Help nahi karte. Kya yeh service hai? Mera PNR XXXXXX7890.,staff rude nahi karte service pnr xxxxxx,490
MORLY/E/2023/6789012,Train ka schedule kabhi check hi nahi hota. Aaj bhi wait kar raha hoon. Bura haal hai.,train schedule check nahi aaj wait bura haal,1819
MORLY/E/2023/7890123,Mera paisa ab tak refund nahi hua. Kya aap log sirf baten karne ke liye hain? Account XXXXXX4567.,paisa refund nahi log sirf baten account xxxxxx,1605
MORLY/E/2023/8901234,Platform ki halat kharab hai. Kahi bhi kehne pe bhi koi nahi sunta hai. Aayiye dekhiye!,platform halat kharab kahi kehne nahi sunta aayiye dekhiye,642
MORLY/E/2023/9012345,Koi bhi madad nahi karta. Mere issue par koi jawab nahi diya. Yeh kya hai?,nahi karta issue jawab nahi,2032
MORLY/E/2023/0123456,Railway service bahut kharab hai. Jyada wait karna padta hai. Ye koi service hai kya?,railway service bahut kharab jyada wait padta service,738
MORLY/E/2023/1234567,Mujhe refund nahi mila. Kya aap log sirf bartan karne ke liye hain? XXXXXX7890.,refund nahi mila log sirf bartan xxxxxx,265
MORLY/E/2023/2345678,Station ki safai bahut kharab hai. Aisa nahi chalega. Aap log kya kar rahe hain?,station safai bahut kharab aisa nahi chalega log,297
MORLY/E/2023/3456789,"Staff ka attitude theek nahi hai. Help nahi karte, sirf sunte hain.",staff attitude theek nahi nahi karte sirf sunte,275
MORLY/E/2023/4567890,"Railway ki service acchi nahi hai, kabhi time par nahi aati. Main pareshaan hoon.",railway service acchi nahi time nahi aati main pareshaan,1908
MORLY/E/2023/5678901,"Refund ab tak nahi mila hai. Bahut pareshaan hoon, aap log to sirf bartan karte ho.",refund nahi mila bahut pareshaan log sirf bartan karte,914
MORLY/E/2023/6789012,Railway station ki facilities bahut kharab hain. Ye theek nahi hai! Aap log kya kar rahe ho?,railway station facilities bahut kharab theek nahi log,4
MORLY/E/2023/7890123,Mujhe staff ki training par bahut shikayat hai. Yeh kya hai? Koi madad nahi hoti!,staff training bahut shikayat nahi,373
MORLY/E/2023/8901235,Train mein bahut samasya aati hai. Kya aap log kuch nahi kar sakte? Bahut pareshaan hoon.,train bahut samasya aati log nahi sakte bahut pareshaan,495
MORLY/E/2023/9012346,Payment ki koi confirmation nahi mili. Kya aap log dhyan nahi dete?,payment confirmation nahi mili log dhyan nahi dete,1526
MORLY/E/2023/0123458,Station ki facilities bilkul kharab hain. Aap log kya kar rahe ho?,station facilities kharab log,24
MORLY/E/2023/1234569,Staff ki training bilkul theek nahi hai. Koi madad nahi milti hai!,staff training theek nahi nahi milti,1739
MORLY/E/2023/2345670,Train chalane ka time kabhi nahi hota. Bahut pareshaan hoon.,train chalane time nahi bahut pareshaan,412
MORLY/E/2023/3456781,Mere ticket ka paisa wapas nahi mila. Kya aap log kuch nahi kar sakte?,ticket paisa wapas nahi mila log nahi sakte,32
MORLY/E/2023/1234567,"Mujhe train ka schedule kaafi baar badalta hai, is wajah se mai kabhi kabhi late hote hoon. Aapko dhyan dena chahiye.",train schedule baar badalta wajah mai late aapko dhyan dena chahiye,329
MORLY/E/2023/2345678,Maine ticket book ki thi lekin payment nahi hui. Mere account se paisa deduct ho gaya.,ticket book payment nahi account paisa deduct,271
MORLY/E/2023/3456789,"Station ki facilities bahut kharab hain, toilets gande hain aur seating arrangement theek nahi hai.",station facilities bahut kharab toilets gande seating arrangement theek nahi,2034
MORLY/E/2023/4567890,"Guard ne train mein safety measures ke bare mein nahi bataya, yeh bahut zaroori hai.",guard train safety measures bare nahi bataya bahut zaroori,427
MORLY/E/2023/5678901,"Train ka arrival time pehle se badal gaya hai, iss wajah se mujhe dikkat hoti hai.",train arrival time pehle badal iss wajah dikkat,112
MORLY/E/2023/6789012,"Maine double charges pay kiye hain, mujhe refund chahiye.",double charges pay kiye refund chahiye,415
MORLY/E/2023/7890123,"Platform pe safai nahi hoti. Bahut ganda hai, is wajah se train ke liye khade hone mein dikkat hoti hai.",platform safai nahi bahut ganda wajah train khade hone dikkat,375
MORLY/E/2023/8901234,"Conductor ne mere saath achhe se baat nahi ki, zaroori hai ki staff polite rahe.",conductor saath achhe baat nahi zaroori staff polite,263
MORLY/E/2023/9012345,"Train ka timing bilkul galat hai, baar baar delay hota hai, is wajah se problem hoti hai.",train timing galat baar baar delay wajah problem,1841
MORLY/E/2023/0123456,"Mujhe ticket ka paisa nahi mila jo cancel kiya tha, iska kya hoga?",ticket paisa nahi mila cancel hoga,714
MORLY/E/2023/1234568,Platform par koi seating nahi hai aur safai bhi nahi hoti. Bahut dikkat hoti hai.,platform seating nahi safai nahi bahut dikkat,454
MORLY/E/2023/2345679,Staff ko customer service ke bare mein achhe se nahi samjhaaya gaya hai. Is par dhyaan dena chahiye.,staff customer service bare achhe nahi samjhaaya dhyaan dena chahiye,1325
MORLY/E/2023/3456790,"Mujhe kisi train ka number nahi pata, lekin wo kabhi bhi nahi aati. Bahut samasya hoti hai.",kisi train number nahi pata nahi aati bahut samasya,1215
MORLY/E/2023/4567901,"Mujhe refund nahi mila, maine ticket cancel ki thi. Iska kya hoga?",refund nahi mila ticket cancel hoga,98
MORLY/E/2023/5678902,"Station par koi facilities nahi hain, kuch nahi hai. Bahut pareshani hoti hai.",station facilities nahi nahi bahut pareshani,267
MORLY/E/2023/6789013,"Aaj kal staff ki services achhi nahi rahi hain, unko training ki zarurat hai.",aaj kal staff services achhi nahi unko training zarurat,125
MORLY/E/2023/7890124,"Trains baar baar late ho rahi hain, isliye mujhe pareshani hoti hai.",trains baar baar late isliye pareshani,553
MORLY/E/2023/8901235,"Maine ek refund request ki thi, ab tak kuch nahi hua.",refund request nahi,133
MORLY/E/2023/9012346,"Platform par koi bhi lighting nahi hai, raat ko bahut dikkat hoti hai.",platform lighting nahi raat bahut dikkat,1135
MORLY/E/2023/1234567,"Railway ka train time pe nahi aaya. Bahut der ho gaya tha, bahut pareshani hui.",railway train time nahi bahut der bahut pareshani,1075
MORLY/E/2023/2345678,"Mujhe refund nahi mila hai, maine ticket cancel kiya tha lekin paisa nahi aaya.",refund nahi mila ticket cancel paisa nahi,533
MORLY/E/2023/3456789,"Station par washroom bahut ganda hai. Saaf nahi kiya jata hai, please dekhiye.",station washroom bahut ganda saaf nahi jata dekhiye,242
MORLY/E/2023/4567890,Train staff bilkul rude hain. Unse baat karne mein bahut takleef hoti hai.,train staff rude unse baat bahut takleef,658
MORLY/E/2023/5678901,"Train chhodne se pehle platform par announce nahi hota, bahut dikkat hoti hai.",train chhodne pehle platform announce nahi bahut dikkat,796
MORLY/E/2023/6789012,"Mujhe online ticket kharidne par payment nahi hui, par amount deduct ho gaya.",online ticket kharidne payment nahi amount deduct,520
MORLY/E/2023/7890123,Platform par seating arrangement bahut kharab hai. Log khade rehte hain.,platform seating arrangement bahut kharab log khade rehte,156
MORLY/E/2023/8901234,"Conductor ne mujhe seat nahi di, bahut bura experience hua.",conductor seat nahi bahut bura experience,30
MORLY/E/2023/9012345,Train ka route badal gaya bina kisi notice ke. Kaafi samasya hui.,train route badal bina kisi notice samasya,1008
MORLY/E/2023/0123456,Ticket cancel karne par refund nahi mil raha. Bahut samasya ho rahi hai.,ticket cancel refund nahi mil bahut samasya,1302
MORLY/E/2023/1234561,"Platform par paani bhara hua hai, logo ko dikkat ho rahi hai. Please dekhiye.",platform paani bhara logo dikkat dekhiye,708
MORLY/E/2023/2345672,"Staff ne mujhe galat information di, kaafi samasya hui.",staff galat information samasya,473
MORLY/E/2023/3456783,Train ki frequency bahut kam hai. Bahut dikkat hoti hai.,train frequency bahut kam bahut dikkat,424
MORLY/E/2023/4567894,"Mujhe ticket kharidte waqt payment nahi mila, bahut samasya hai.",ticket kharidte waqt payment nahi mila bahut samasya,877
MORLY/E/2023/5678905,"Railway station par parking kaafi kharab hai, please improve karein.",railway station parking kharab improve,39
MORLY/E/2023/6789016,"Koi bhi staff madad nahi kar raha, bahut dikkat hui.",staff nahi bahut dikkat,927
MORLY/E/2023/7890127,"Train ka delay ho gaya, koi information nahi di gayi.",train delay information nahi,1228
MORLY/E/2023/8901238,"Online payment fail ho raha hai, please kuch karein.",online payment fail,804
MORLY/E/2023/9012349,"Station par lights nahi hain, bahut andhera hota hai.",station lights nahi bahut andhera,1116
MORLY/E/2023/0123450,"Staff ka behavior bahut accha nahi hai, problem ho rahi hai.",staff behavior bahut accha nahi problem,542
MORLY/E/2023/1234561,Train ka platform change kar diya bina kisi notice ke. Please dekhiye.,train platform change bina kisi notice dekhiye,488
MORLY/E/2023/2345672,"Mujhe ticket ki payment nahi mili, bahut dikkat hai.",ticket payment nahi mili bahut dikkat,74
MORLY/E/2023/1234567,"Train ka time barabar nahi hai, bahut takleef hoti hai. Please kuch karein.",train time barabar nahi bahut takleef,1320
MORLY/E/2023/2345678,"Mujhe ticket ke liye payment ki confirmation nahi mili, koi dikkat hai kya?",ticket payment confirmation nahi mili dikkat,763
MORLY/E/2023/3456789,"Conductor ne ticket check nahi kiya aur rude behave kiya, bahut bura laga.",conductor ticket check nahi rude behave bahut bura laga,1284
MORLY/E/2023/4567890,"Platform pe safai nahi ho rahi hai, bahut gandh hai, kuch karein!",platform safai nahi bahut gandh,514
MORLY/E/2023/5678901,"Train ka delay bahut hota hai, koi proper system nahi hai. Please dekhein!",train delay bahut proper system nahi dekhein,244
MORLY/E/2023/6789012,"Mujhe refund nahi mila ab tak, kya problem hai? PNR: XXXXXX.",refund nahi mila problem pnr xxxxxx,830
MORLY/E/2023/7890123,"Staff ne mujhe samajh nahi paya, unki attitude ka kuch nahi hota.",staff samajh nahi paya unki attitude nahi,1986
MORLY/E/2023/8901234,"Station ki building bahut purani hai, naye infrastructure ki zarurat hai.",station building bahut purani naye infrastructure zarurat,49
MORLY/E/2023/9012345,"Train ka jaane ka samay change ho gaya bina kisi suchna ke, kaisa hai yeh?",train jaane samay change bina kisi suchna kaisa,0
MORLY/E/2023/0123456,"Mujhe ticket ka refund nahi mila, please help! PNR: XXXXXX.",ticket refund nahi mila pnr xxxxxx,597
MORLY/E/2023/1234568,"Railway staff ne mujhe ghalat information di, kaafi samay barbaad hua.",railway staff ghalat information samay barbaad,1277
MORLY/E/2023/2345679,"Platform pe sochne ke liye jagah nahi hai, khud pe chalte chalte gir gaya.",platform sochne jagah nahi khud chalte chalte gir,380
MORLY/E/2023/3456780,"Train ka service bahut kharab hai, samasya jaldi hal karein.",train service bahut kharab samasya jaldi hal,786
MORLY/E/2023/4567891,"Refund nahi mila ab tak, PNR: XXXXXX, kya ho raha hai?",refund nahi mila pnr xxxxxx,597
MORLY/E/2023/5678902,"Staff ki training nahi hui, unka behavior theek nahi hai.",staff training nahi behavior theek nahi,403
MORLY/E/2023/6789013,"Station ki infrastructure bahut poor hai, kuch upgrade ki zarurat hai.",station infrastructure bahut poor upgrade zarurat,176
MORLY/E/2023/7890124,"Train time pe nahi aayi, bahut issues hain, please dekhein.",train time nahi bahut issues dekhein,1572
MORLY/E/2023/8901235,"Mujhe refund ka status chahiye, ab tak nahi mila, kya karna hai?",refund status chahiye nahi mila,724
MORLY/E/2023/9012346,"Staff ne mujhe samajh nahi paya, unka behavior theek nahi hai.",staff samajh nahi paya behavior theek nahi,249
MORLY/E/2023/1234567,Train ka time change ho gaya hai. Pichle mahine se kuch nahi badla. Bahut pareshani ho rahi hai!,train time change pichle mahine nahi badla bahut pareshani,231
MORLY/E/2023/2345678,Online ticket booking ke liye payment nahi ho raha hai. Mere account ka number XXXXXX1234 hai.,online ticket booking payment nahi account number xxxxxx,261
MORLY/E/2023/3456789,Station par facilities bahut kharab hain. Toilets gande hain aur benches bhi nahi hain.,station facilities bahut kharab toilets gande benches nahi,985
MORLY/E/2023/4567890,Railway staff ka behavior bahut bura hai. Unhone mujhe bura bola jab maine unse madad maangi.,railway staff behavior bahut bura unhone bura bola jab unse maangi,753
MORLY/E/2023/5678901,Train ka delay baar-baar ho raha hai. Mere paas important meeting hai!,train delay baarbaar paas important meeting,1699
MORLY/E/2023/6789012,Ticket cancel karne par refund nahi mila. Mere account ka no. XXXXXX9876 hai.,ticket cancel refund nahi mila account xxxxxx,978
MORLY/E/2023/7890123,"Platform par safety measures nahi hain. Bahut khatar hai, please kuch karein.",platform safety measures nahi bahut khatar,350
MORLY/E/2023/8901234,Staff se baat karne par gussa hota hai. Kya yeh sahi hai? Please kuch karein.,staff baat gussa sahi,154
MORLY/E/2023/9012345,Train se baahar jane ka time nahi hai. Kahi nahi mil raha hai koi.,train baahar jane time nahi kahi nahi mil,1496
MORLY/E/2023/0123456,Mujhe coupon se discount nahi mila. Bahut pareshan hoon.,coupon discount nahi mila bahut pareshan,274
MORLY/E/2023/1234568,Station par parking ka bahut bada dikkat hai. Bahut samasya hoti hai.,station parking bahut bada dikkat bahut samasya,494
MORLY/E/2023/2345679,Conductor hamesha late hota hai. Ticket check karne me samay lagta hai.,conductor hamesha late ticket check samay lagta,1222
MORLY/E/2023/3456780,Train mein toilets gande hain. Kya kuch nahi hota iske liye?,train toilets gande nahi iske,1724
MORLY/E/2023/4567891,Payment fail ho raha hai jab bhi main ticket book karta hoon. Bahut pareshaan hoon.,payment fail jab main ticket book karta bahut pareshaan,552
MORLY/E/2023/5678902,Platform par behtareen suvidhaon ki kami hai. Bahut dikkat hoti hai.,platform behtareen suvidhaon kami bahut dikkat,845
MORLY/E/2023/6789013,Railway staff se baat karne par unka behavior bura hai. Kya kuch nahi kiya ja sakta?,railway staff baat behavior bura nahi sakta,577
MORLY/E/2023/7890124,Train ki timing kabhi sahi nahi hoti. Bahut baar delay hota hai.,train timing sahi nahi bahut baar delay,988
MORLY/E/2023/8901235,Mujhe refund nahi mila jab maine ticket cancel ki. Bahut pareshaan hoon.,refund nahi mila jab ticket cancel bahut pareshaan,598
MORLY/E/2023/1234567,"Train ka time barbad ho gaya, koi information nahi mili. Just 2 gante se wait kar rahe hain.",train time barbad information nahi mili gante wait,144
MORLY/E/2023/2345678,"Payment karne par refund nahi mila, account number XXXXXX. Bahut pareshaan hoon abhi.",payment refund nahi mila account number xxxxxx bahut pareshaan abhi,1156
MORLY/E/2023/3456789,"Station pe cleaning nahi ho rahi hai, safai bahut kharab hai. Aise nahi chalega.",station cleaning nahi safai bahut kharab aise nahi chalega,297
MORLY/E/2023/4567890,"Staff ka behavior bahut rude hai, koi respect nahi hai passengers ke liye. Bahut bura laga.",staff behavior bahut rude respect nahi passengers bahut bura laga,248
MORLY/E/2023/5678901,"Train ka delay ho gaya, koi information nahi hai. PNR XXXXXXXXXX hai.",train delay information nahi pnr xxxxxxxxxx,1228
