registration_no,subject_content_text,cleaned_text,agg_cluster
MORLY/E/2023/4567890,Station par facilities bahut kharab hain. Toilets aur waiting area mein problems hain.,station facilities bahut kharab toilets waiting area problems,624
MORLY/E/2023/5678901,"Train ko late karne ka koi reason nahi diya gaya. Aisa hona nahi chahiye, please is par dhyaan dein.",train late reason nahi aisa nahi chahiye dhyaan dein,1119
MORLY/E/2023/6789012,Payment karne par mujhe koi confirmation nahi mila. Bahut samasya ho rahi hai.,payment confirmation nahi mila bahut samasya,602
MORLY/E/2023/7890123,"Railway personnel ki training bahut zaroori hai. Unka behavior theek nahi hai, is par dhyaan dein.",railway personnel training bahut zaroori behavior theek nahi dhyaan dein,1360
MORLY/E/2023/8901234,Station ki cleanliness aur facilities bahut kharab hain. Aapko is par dhyaan dena chahiye.,station cleanliness facilities bahut kharab aapko dhyaan dena chahiye,1649
MORLY/E/2023/9012345,Train ka service bahut kharab hai. Aakaar se der se aana aur jaana ho raha hai. Is par dhyaan dena chahiye.,train service bahut kharab aakaar der aana jaana dhyaan dena chahiye,1674
MORLY/E/2023/0123456,Mujhe booking ke time payment nahi mil raha hai. Bahut badi samasya hai.,booking time payment nahi mil bahut badi samasya,2004
MORLY/E/2023/1230987,Railway staff ko training ki bahut zarurat hai. Unka behavior kabhi kabhi theek nahi hota.,railway staff training bahut zarurat behavior theek nahi,888
MORLY/E/2023/2340987,Station ki cleanliness aur security mein bahut kami hai. Is par turant dhyaan dena chahiye.,station cleanliness security bahut kami turant dhyaan dena chahiye,1649
MORLY/E/2023/3450987,Train service ki quality bahut kharab hai. Is par dhyaan dena hoga.,train service quality bahut kharab dhyaan dena hoga,2009
MORLY/E/2023/4560987,Maine ticket book kiya tha lekin payment nahi ho raha tha. Bahut badi samasya ho rahi hai.,ticket book payment nahi bahut badi samasya,967
MORLY/E/2023/5670987,Railway staff ko jyada training ki zarurat hai. Unka behavior kabhi kabhi theek nahi hota.,railway staff jyada training zarurat behavior theek nahi,888
MORLY/E/2023/6780987,Station ki facilities bahut kharab hain. Toilets aur waiting area mein problems hain.,station facilities bahut kharab toilets waiting area problems,624
MORLY/E/2023/7890987,Train ka service bahut bekar hai. Har baar der se aati hai.,train service bahut bekar har baar der aati,546
MORLY/E/2023/8900987,Mujhe ticket ke liye payment nahi mil raha tha. Bahut time lag raha hai.,ticket payment nahi mil bahut time lag,1522
MORLY/E/2023/9010987,Railway staff ki training zaruri hai. Unka behavior theek nahi hai.,railway staff training zaruri behavior theek nahi,1199
MORLY/E/2023/1234567,"Train ka schedule baar baar badal raha hai, samay par nahi chal rahi hai.",train schedule baar baar badal samay nahi chal,399
MORLY/E/2023/2345678,"Mera refund ab tak nahi aaya hai, booking ID kya hai, samjhiye.",refund nahi booking samjhiye,405
MORLY/E/2023/3456789,"Guard sahab ki madad nahi mil rahi hai, kuch nahi kar rahe hain.",guard sahab nahi mil nahi,1150
MORLY/E/2023/4567890,"Platform bahut kharab hai, safai nahi hoti, khud ko khud sambhalna pada.",platform bahut kharab safai nahi khud khud sambhalna pada,380
MORLY/E/2023/5678901,"Train delay hone se bada parishan ho gaya hoon, kaam khatam nahi ho raha.",train delay hone bada parishan kaam khatam nahi,582
MORLY/E/2023/6789012,"Mera payment nahi hua hai, kis prakar ka issue hai mujhe samjhaiye.",payment nahi kis prakar issue samjhaiye,541
MORLY/E/2023/7890123,"Railway staff bahut rude hain, kuch nahi samajhte hain.",railway staff bahut rude nahi samajhte,222
MORLY/E/2023/8901234,"Station ki building bahut purani hai, repair ki zarurat hai.",station building bahut purani repair zarurat,49
MORLY/E/2023/9012345,"Train ka time bahut odd hai, samay par nahi milta.",train time bahut odd samay nahi milta,589
MORLY/E/2023/0123456,"Maine ticket book kiya tha, par card charge nahi hua hai.",ticket book card charge nahi,1520
MORLY/E/2023/1234568,Railway staff aksar samasya ko samajh nahi paa rahe hain.,railway staff aksar samasya samajh nahi paa,1549
MORLY/E/2023/2345679,"Station par safai nahi hoti, badi samasya ho gayi hai.",station safai nahi badi samasya,118
MORLY/E/2023/3456790,"Train ko time pe nahi chhod rahe hain, baithne ki jagah nahi mil rahi.",train time nahi chhod baithne jagah nahi mil,245
MORLY/E/2023/4567891,"Refund ka case maine daala tha, ab tak koi response nahi aaya.",refund case daala response nahi,280
MORLY/E/2023/5678902,"Railway staff aaj kal bilkul madad nahi kar rahe hain, samasya hai.",railway staff aaj kal nahi samasya,1705
MORLY/E/2023/6789013,"Station ki building bahut kharab halat mein hai, turant kuch karna chahiye.",station building bahut kharab halat turant chahiye,1547
MORLY/E/2023/7890124,"Train ki cleanliness bahut kharab hai, koi safai nahi kar raha.",train cleanliness bahut kharab safai nahi,137
MORLY/E/2023/8901235,"Mera payment confirm nahi hua hai, kahan hai mera paisa?",payment confirm nahi paisa,199
MORLY/E/2023/6574321,Mujhe train ke delay ki wajah se bahut dikkat hui. Pichle 2 mahine se baar baar ho raha hai!,train delay wajah bahut dikkat pichle mahine baar baar,337
MORLY/E/2023/8912345,Mujhe payment gateway mein problem aayi hai. Mere paise deduct ho gaye par ticket nahi mili.,payment gateway problem paise deduct ticket nahi mili,422
MORLY/E/2023/3456789,Railway staff ke behavior kaafi kharab hai. Unhone mujhe theek se help nahi kiya.,railway staff behavior kharab unhone theek nahi,269
MORLY/E/2023/7891234,Station par washroom ki safai bahut kharab hai. Koi bhi dhyaan nahi deta.,station washroom safai bahut kharab dhyaan nahi deta,1012
MORLY/E/2023/1234567,Train ka schedule har baar change hota hai. Is wajah se mujhe kaafi problem hoti hai.,train schedule har baar change wajah problem,1093
MORLY/E/2023/2345678,Mere account se paise nahi aaye. Ticket confirm nahi hui hai. Yeh kya ho raha hai?,account paise nahi aaye ticket confirm nahi,284
MORLY/E/2023/4567890,Ticket booking ke dauran staff ka behavior bahut bura tha. Mujhe koi madad nahi mili.,ticket booking dauran staff behavior bahut bura nahi mili,1712
MORLY/E/2023/6789012,"Station par safai bohot kharab hai. Kahi bhi safai nahi hai, mehsoos hota hai ki koi dikhta hi nahi.",station safai bohot kharab kahi safai nahi mehsoos dikhta nahi,1655
MORLY/E/2023/7890123,Train baar baar cancel ho ja rahi hai aur mujhe safar karne mein problem ho rahi hai.,train baar baar cancel safar problem,429
MORLY/E/2023/8901234,Mere payment ke liye koi confirmation nahi aayi. Mere paise ka kya hoga?,payment confirmation nahi paise hoga,936
MORLY/E/2023/9012345,Kuch staff members kaafi rude hain. Unhone meri complaint ko seriously nahi liya.,staff members rude unhone complaint seriously nahi,54
MORLY/E/2023/0123456,Station ki building ki condition acchi nahi hai. Bahar se dekhne par bilkul hi bura lagta hai.,station building condition acchi nahi bahar dekhne bura lagta,1617
MORLY/E/2023/1234560,Train ki timing kabhi bhi sahi nahi hoti. Is wajah se meri meetings miss ho ja rahi hain.,train timing sahi nahi wajah meetings miss,179
MORLY/E/2023/2345671,Mujhe payment ka confirmation nahi mila. Mere paise ka kya hoga?,payment confirmation nahi mila paise hoga,936
MORLY/E/2023/3456782,Staff ki attitude bahut kharab hai. Unhone meri madad nahi ki.,staff attitude bahut kharab unhone nahi,10
MORLY/E/2023/4567893,Railway stations par infrastructure bilkul theek nahi hai. Ye dekhna bahut zaroori hai.,railway stations infrastructure theek nahi dekhna bahut zaroori,1741
MORLY/E/2023/5678904,Mujhe train ki booking mein bahut dikkat ho rahi hai. Koi help nahi kar raha.,train booking bahut dikkat nahi,1351
MORLY/E/2023/2345678,"Train time table sahi nahi hai, pichle 2 hafte se delay ho raha hai. Koi solution nahi mil raha hai.",train time table sahi nahi pichle hafte delay solution nahi mil,285
MORLY/E/2023/3456789,"Maine ticket book kiya tha, lekin payment nahi hui. Paisa wapas nahi hua ab tak.",ticket book payment nahi paisa wapas nahi,1389
MORLY/E/2023/4567890,"Train service kaafi bekar hai. Bahut late hota hai, staff bhi cooperate nahi karta.",train service bekar bahut late staff cooperate nahi karta,78
MORLY/E/2023/5678901,"Platform ki safai bahut kharab hai. Kahi bhi khudai chali hui hai, koi dhyan nahi de raha.",platform safai bahut kharab kahi khudai chali dhyan nahi,341
MORLY/E/2023/6789012,"Staff ka behavior aaj kal acha nahi hai. Kisi ko kuch help nahi karte, rude hain sab.",staff behavior aaj kal acha nahi kisi nahi karte rude,181
MORLY/E/2023/7890123,"Trains ka time schedule bilkul sahi nahi hai. 2 ghante late ho raha hai, koi notice nahi hai.",trains time schedule sahi nahi ghante late notice nahi,1586
MORLY/E/2023/8901234,Payment nahi ho raha hai. Koi error aa raha hai jab mai card use karta hu.,payment nahi error jab mai card use karta,1483
MORLY/E/2023/9012345,"Railway stations ki safai bahut kharab hai. Kahi bhi kachra pada hai, koi dhyan nahi de raha.",railway stations safai bahut kharab kahi kachra pada dhyan nahi,341
MORLY/E/2023/0123456,Staff ka attitude thoda behtar hona chahiye. Bahut rude hain wo log.,staff attitude thoda behtar chahiye bahut rude log,880
MORLY/E/2023/1234567,"Train punctuality bahut kharab hai. Har baar late hoti hai, bahut pareshani hoti hai.",train punctuality bahut kharab har baar late bahut pareshani,945
MORLY/E/2023/2345679,"Mujhe refund nahi mila hai. Main ne ticket cancel kiya tha, lekin paisa nahi wapas aaya.",refund nahi mila main ticket cancel paisa nahi wapas,1954
MORLY/E/2023/3456780,"Railway station par bahut badi samasya hai. Infrastructure theek nahi hai, bahut pareshani hoti hai.",railway station bahut badi samasya infrastructure theek nahi bahut pareshani,1742
MORLY/E/2023/4567891,Station par staff se achhi service milni chahiye. Kahi baar koi madad nahi karta.,station staff achhi service milni chahiye kahi baar nahi karta,1895
MORLY/E/2023/5678902,"Train delay bahut zyada ho raha hai, koi bhi samadhan nahi mil raha hai.",train delay bahut zyada samadhan nahi mil,1313
MORLY/E/2023/6789013,"Ticket cancel kiya tha, lekin refund kab aayega, koi pata nahi.",ticket cancel refund aayega pata nahi,136
MORLY/E/2023/7890124,"Station ki building purani ho gayi hai, thoda renovation hona chahiye.",station building purani thoda renovation chahiye,619
MORLY/E/2023/8901235,"Kahi baar staff ki training ki kami hoti hai, service bekar hoti hai.",kahi baar staff training kami service bekar,326
MORLY/E/2023/9012346,"Train bekar chal rahi hai, baar baar delay ho raha hai, koi samadhan nahi mil raha.",train bekar chal baar baar delay samadhan nahi mil,1790
MORLY/E/2023/0123457,"Payment ka issue tha, lekin ab theek ho gaya hai, thank you.",payment issue theek thank,416
MORLY/E/2023/1234568,"Station par koi basic facilities nahi hain. Toilet, pani nahi hai. Bahut mushkil hoti hai.",station basic facilities nahi toilet pani nahi bahut mushkil,93
MORLY/E/2023/4567890,"Train ka time pe nahi aaya, bahut pareshani hui. Koi system update nahi hai.",train time nahi bahut pareshani system update nahi,150
MORLY/E/2023/3456789,Payment nahi hui mujhe refund chahiye. Main baar baar call kar rahi hoon par koi jawab nahi.,payment nahi refund chahiye main baar baar call jawab nahi,304
MORLY/E/2023/4567890,Thoda rude staff hai train ke andar. Koi baat nahi kar raha hai. Sabko ghamand hai.,thoda rude staff train andar baat nahi sabko ghamand,769
MORLY/E/2023/5678901,Station ka infrastructure bahut kharab hai. Safai nahi hai aur facilities bhi nahi hai.,station infrastructure bahut kharab safai nahi facilities nahi,1728
MORLY/E/2023/6789012,"Train baar baar late hoti hai, koi bhi notice nahi milta hai. Bahut dikkat ho rahi hai.",train baar baar late notice nahi milta bahut dikkat,206
MORLY/E/2023/7890123,"Mujhe refund nahi mila, PNR XXXXXX ke liye. Bahut samasya ho rahi hai.",refund nahi mila pnr xxxxxx bahut samasya,597
MORLY/E/2023/8901234,I had a bad experience with the staff on train XXXXXX. They were very rude and unhelpful.,bad experience staff train xxxxxx rude unhelpful,1315
MORLY/E/2023/9012345,"Station par safai nahi hoti, aur washrooms bhi bahut gande hain. Yeh sab sudharne ki zarurat hai.",station safai nahi washrooms bahut gande sudharne zarurat,960
MORLY/E/2023/0123456,"Train ka schedule theek nahi hai, kisi bhi baar samay par nahi aati. Aap log kya kar rahe hain?",train schedule theek nahi kisi baar samay nahi aati log,1886
MORLY/E/2023/1234567,"Mujhe refund nahi mila, PNR XXXXXX ke liye. Bahut dikkat ho rahi hai.",refund nahi mila pnr xxxxxx bahut dikkat,597
MORLY/E/2023/3456789,"Staff ki service bahut kharab hai, koi bhi madad nahi karta hai jab zarurat hoti hai.",staff service bahut kharab nahi karta jab zarurat,1646
MORLY/E/2023/5678901,"Platform par safai nahi hoti, aur kuch facilities bhi nahi hai, bahut dikkat hoti hai.",platform safai nahi facilities nahi bahut dikkat,454
MORLY/E/2023/6789012,"Train ka time pe nahi aane se bahut pareshani hoti hai, yeh baar baar ho raha hai.",train time nahi aane bahut pareshani baar baar,1781
MORLY/E/2023/7890123,"Mujhe refund nahi mila, PNR XXXXXX ke liye, kab milega yeh pata nahi.",refund nahi mila pnr xxxxxx milega pata nahi,597
MORLY/E/2023/8901234,"Thoda rude staff hai train ke andar, unse baat karke kuch nahi hua.",thoda rude staff train andar unse baat nahi,769
MORLY/E/2023/9012345,"Platform par safai nahi hoti, bahut dikkat hoti hai, isme sudhar chahiye.",platform safai nahi bahut dikkat isme sudhar chahiye,143
MORLY/E/2023/0123456,"Train late hoti hai aur kabhi kabhi cancel bhi, kya aap log kuch nahi kar rahe?",train late cancel log nahi,592
MORLY/E/2023/1234567,"Mujhe refund nahi mila, kab milega, samasya hai bar bar phone karne par bhi kuch nahi mil raha.",refund nahi mila milega samasya bar bar phone nahi mil,803
MORLY/E/2023/3456789,"Staff ki behavior bilkul achha nahi hai, unse koi madad nahi milti hai.",staff behavior achha nahi unse nahi milti,1938
MORLY/E/2023/9876543,Mujhe train ki timing ke baare mein information nahi mil rahi hai. Please help!,train timing baare information nahi mil,594
MORLY/E/2023/1234567,"Mera payment confirm nahi hua hai, please madad karein! Mera account number XXXXXX1234 hai.",payment confirm nahi account number xxxxxx,261
MORLY/E/2023/2345678,Train staff ka behaviour theek nahi tha. Unhe training ki zaroorat hai.,train staff behaviour theek nahi training zaroorat,532
MORLY/E/2023/3456789,Station pe facilities bahut kharab hain. Toilets clean nahi hain aur benches bhi nahi hain.,station facilities bahut kharab toilets clean nahi benches nahi,985
MORLY/E/2023/4567890,Train ka schedule baar baar change ho raha hai. Yeh bahut pareshan kar raha hai.,train schedule baar baar change bahut pareshan,776
MORLY/E/2023/5678901,Mujhe refund ka koi update nahi mila. Mera PNR XXXXXX7890 hai.,refund update nahi mila pnr xxxxxx,597
MORLY/E/2023/6789012,Mujhe train ke staff se bura vyavhaar mila. Yeh bilkul nahi hona chahiye.,train staff bura vyavhaar mila nahi chahiye,1410
MORLY/E/2023/7890123,Platform ki safai bilkul nahi ho rahi hai. Yeh bahut kharab hai. Please dekhein!,platform safai nahi bahut kharab dekhein,518
MORLY/E/2023/8901234,Train ka delay baar baar ho raha hai. Is par dhyan dena chahiye!,train delay baar baar dhyan dena chahiye,441
MORLY/E/2023/9012345,Mujhe meri ticket ka refund nahi mila. PNR XXXXXX4567 hai.,ticket refund nahi mila pnr xxxxxx,597
MORLY/E/2023/0123456,Train staff ka behaviour theek nahi hai. Yeh theek nahi hai.,train staff behaviour theek nahi theek nahi,532
MORLY/E/2023/1234567,Station pe bahut gandi safai hai. Is par dhyan dena chahiye.,station bahut gandi safai dhyan dena chahiye,33
MORLY/E/2023/2345678,Train ka schedule bilkul clear nahi hai. Iski jaankari chahiye.,train schedule clear nahi iski jaankari chahiye,71
MORLY/E/2023/3456789,Mujhe refund nahi mila. Mera account number XXXXXX5678 hai.,refund nahi mila account number xxxxxx,1156
MORLY/E/2023/4567890,Train staff ka vyavhaar sahi nahi tha. Is par kuch action hona chahiye.,train staff vyavhaar sahi nahi action chahiye,58
MORLY/E/2023/5678901,Station ki safai bilkul nahi ho rahi hai. Yeh bahut samasya hai.,station safai nahi bahut samasya,1463
MORLY/E/2023/6789012,Train ka seat confirmation nahi hua. Is se related koi jankari nahi hai.,train seat confirmation nahi related jankari nahi,674
MORLY/E/2023/7890123,Mera ticket ka refund nahi hua hai. Please help me out! Mera PNR XXXXXX1234 hai.,ticket refund nahi pnr xxxxxx,846
MORLY/E/2023/1234567,Train 12345 baar baar late hoti hai. Pichle 2 mahine se yahi hal hai. Please kuch karein.,train baar baar late pichle mahine yahi hal,337
MORLY/E/2023/2345678,Mujhe refund nahi mila hai. Mera refund request number X0X5X hai. Help karein.,refund nahi mila refund request number xxx,133
MORLY/E/2023/3456789,Railway staff ki behavior achha nahi hai. Unka attitude bahut bekar hai.,railway staff behavior achha nahi attitude bahut bekar,1704
MORLY/E/2023/4567890,Station par cleanliness bahut kharab hai. Saaf safai ka dhyan nahi rakha ja raha.,station cleanliness bahut kharab saaf safai dhyan nahi rakha,1080
MORLY/E/2023/5678901,Train ka schedule bar-bar change hota hai. Yeh bahut dikkat hai.,train schedule barbar change bahut dikkat,97
MORLY/E/2023/6789012,Mujhe ticket booking ke baad confirmation email nahi mila. Kya yeh normal hai?,ticket booking baad confirmation email nahi mila normal,848
MORLY/E/2023/7890123,Staff ke behavior mein sudhar ki zaroorat hai. Unka attitude kabhi kabhi rude hota hai.,staff behavior sudhar zaroorat attitude rude,655
MORLY/E/2023/8901234,Platform par safety measures ki kami hai. Yeh khatarnaak ho sakta hai.,platform safety measures kami khatarnaak sakta,350
MORLY/E/2023/9012345,Train ka timing baar baar change hota hai. Bahut dikkat hoti hai.,train timing baar baar change bahut dikkat,279
MORLY/E/2023/0123456,Mere ticket ka payment nahi hua. Mera transaction ID X-X-X-X hai. Kripya madad karein.,ticket payment nahi transaction xxxx kripya,580
MORLY/E/2023/1234568,Railway ke employees thoda zyada rude ho gaye hain. Aisa nahi hona chahiye.,railway employees thoda zyada rude aisa nahi chahiye,50
MORLY/E/2023/2345679,Train station par toilets bahut gande hain. Kripya kuch karein.,train station toilets bahut gande kripya,744
MORLY/E/2023/3456780,"Train mein seat nahi mil rahi hai, jabki online book kar raha hoon. Yeh ek samasya hai.",train seat nahi mil jabki online book samasya,725
MORLY/E/2023/4567891,"Mera payment failed, mujhe confirmation nahi mili. Transaction ID X0X5X hai.",payment failed confirmation nahi mili transaction xxx,763
MORLY/E/2023/5678902,Staff ka behavior accha nahi hai. Unhe training ki zaroorat hai.,staff behavior accha nahi training zaroorat,794
MORLY/E/2023/6789013,Station par water supply ki kami hai. Kripya ispar dhyan dein.,station water supply kami kripya ispar dhyan dein,266
MORLY/E/2023/7890124,Train ki timings baar baar delay hoti hai. Yeh bahut takleef de hai.,train timings baar baar delay bahut takleef,149
MORLY/E/2023/8901235,Mera ticket payment nahi ho raha hai. Transaction ID X0X5X hai.,ticket payment nahi transaction xxx,580
MORLY/E/2023/9012346,Railway ke staff ka behavior samajhdari nahi hai. Unhe training ki zaroorat hai.,railway staff behavior samajhdari nahi training zaroorat,794
MORLY/E/2023/0123457,Station ki cleaning bahut kharab hai. Saaf safai par dhyan dena chahiye.,station cleaning bahut kharab saaf safai dhyan dena chahiye,627
MORLY/E/2023/9876543,"Train ki timing bahut late hoti hai, mujhe office time pe nahi pahuncha paya. Iska kuch solution do.",train timing bahut late office time nahi pahuncha paya solution,205
MORLY/E/2023/1234567,Mainne online ticket book ki thi par payment nahi hui. Mere paise wapas karo.,mainne online ticket book payment nahi paise wapas,1627
MORLY/E/2023/3456789,"Platform 2 par safai nahi hoti. Bahut ganda hai, kya kuch nahi kar sakte?",platform safai nahi bahut ganda nahi sakte,375
MORLY/E/2023/9871234,"Conductor bahut rude hai, mujhe iss baare mein complain karna hai.",conductor bahut rude iss baare complain,701
MORLY/E/2023/6548901,"Train mein AC nahi chal raha tha, bahar ke mausam ki wajah se bahut garmi thi.",train nahi chal bahar mausam wajah bahut garmi,1504
MORLY/E/2023/2468013,"Mera refund nahi aaya, maine 2 weeks pehle cancel kiya tha. Kya kar sakti hoon?",refund nahi weeks pehle cancel sakti,1046
MORLY/E/2023/8642097,"Station ki building bohot purani hai, nayi building banane ki avashyakta hai.",station building bohot purani nayi building banane avashyakta,1764
MORLY/E/2023/2583697,"Mujhe guard ki taraf se kisi tarah ki madad nahi mili, wo bilkul ignore kar rahe the.",guard taraf kisi tarah nahi mili ignore,1923
MORLY/E/2023/4567892,"Train mein khana nahi mil raha tha. Bahut samay ho gaya tha, khud hi khana lekar jaana pada.",train khana nahi mil bahut samay khud khana lekar jaana pada,83
MORLY/E/2023/7531598,"Mere payment gateway mein error aa raha hai, kuch kar sakte ho?",payment gateway error sakte,1003
MORLY/E/2023/1597530,Railway station par toilets ki safai nahi hoti. Bahut ganda hai.,railway station toilets safai nahi bahut ganda,73
MORLY/E/2023/3698521,Mere saath ticket collector ne achha vyavhar nahi kiya. Kya aap kuch kar sakte ho?,saath ticket collector achha vyavhar nahi sakte,768
MORLY/E/2023/7896543,Train ka time table bilkul galat hai. Isse badal nahi sakte kya?,train time table galat isse badal nahi sakte,1158
MORLY/E/2023/2587631,Maine ticket book kiya tha par payment nahi hua. Mere paise wapas karo.,ticket book payment nahi paise wapas,1627
MORLY/E/2023/7531599,Station par parking ka bahut samasya hai. Parking area chhota hai.,station parking bahut samasya parking area chhota,494
MORLY/E/2023/9638527,Mujhe kisi staff ne galat information di thi. Bahut pareshaan ho gayi thi main.,kisi staff galat information bahut pareshaan main,473
MORLY/E/2023/1234567,"Train ka schedule bahut hi galat hai, bahut delay ho raha hai. Specially morning trains. Please dekhiye.",train schedule bahut galat bahut delay specially morning trains dekhiye,1995
MORLY/E/2023/2345678,"Meri payment ka issue hai, maine 2 din pehle book kiya tha lekin paisa nahi gaya. Kya hua?",payment issue din pehle book paisa nahi,1700
MORLY/E/2023/3456789,Railway staff ki attitude bahut kharab hai. Unse baat karna mushkil hai aur help nahi karte. Please dekhiye.,railway staff attitude bahut kharab unse baat mushkil nahi karte dekhiye,639
MORLY/E/2023/4567890,"Platform pe bahut gande halat hain, safai nahi hoti. Sab jagah kachra hai. Jaldi kuch karein.",platform bahut gande halat safai nahi jagah kachra jaldi,935
MORLY/E/2023/5678901,Train time pe nahi aa rahi hai. Bahut time ho gaya lekin koi update nahi. Kya hota hai?,train time nahi bahut time update nahi,561
MORLY/E/2023/6789012,Mere refund ka status nahi mil raha hai. Kab milega? Yeh bahut samasya hai.,refund status nahi mil milega bahut samasya,188
MORLY/E/2023/7890123,Railway ke staff ki training bahut kamzor hai. Unhe customer service ki zaroorat hai.,railway staff training bahut kamzor customer service zaroorat,564
MORLY/E/2023/8901234,Station ka washroom bahut ganda hai aur use karne layak nahi hai. Safai karne ki zaroorat hai.,station washroom bahut ganda use layak nahi safai zaroorat,621
MORLY/E/2023/9012345,"Train ka platform change kar diya, bina kisi notice ke. Yeh theek nahi hai.",train platform change bina kisi notice theek nahi,488
MORLY/E/2023/0123456,Mera ticket cancel ho gaya lekin refund abhi tak nahi mila. Kya yeh theek hai?,ticket cancel refund abhi nahi mila theek,1085
MORLY/E/2023/1123457,Railway ke employees se help lete waqt bahut dikkat hoti hai. Kya koi training nahi hai?,railway employees lete waqt bahut dikkat training nahi,1634
MORLY/E/2023/2234568,Railway station ke entrance par bahut ganda hai. Safai nahi hoti hai. Kya kuch hoga?,railway station entrance bahut ganda safai nahi hoga,371
MORLY/E/2023/3345679,Train ka route bahut baar badalta hai. Isse logon ko dikkat hoti hai. Kya koi fix hai?,train route bahut baar badalta isse logon dikkat fix,1911
MORLY/E/2023/4456780,Mere ticket ka paisa nahi aaya. Bahut din ho gaye. Kya kuch hoga?,ticket paisa nahi bahut din hoga,1434
MORLY/E/2023/5567891,"Railway staff ki training bahut zaroori hai, unhe training deni hogi warna service nahi chalegi.",railway staff training bahut zaroori training deni hogi warna service nahi chalegi,492
MORLY/E/2023/6678902,Station par koi proper lighting nahi hai. Raat ko khud ko unsafe mehsoos hota hai.,station proper lighting nahi raat khud unsafe mehsoos,1943
MORLY/E/2023/7789013,"Train ka time galat hai, jab bhi check karta hoon wo change ho jata hai. Please kuch karein.",train time galat jab check karta change jata,1050
MORLY/E/2023/8890124,Mujhe payment ka status nahi mil raha. Kab aayega? Yeh bahut zaroori hai.,payment status nahi mil aayega bahut zaroori,276
MORLY/E/2023/1234567,"Train ki timing sahi nahi hai, baar baar late hoti hai. Bahut dikkat hoti hai.",train timing sahi nahi baar baar late bahut dikkat,1785
MORLY/E/2023/7654321,Mujhe ticket ka paisa wapas nahi mila. Kya karna padega?,ticket paisa wapas nahi mila padega,32
MORLY/E/2023/2345678,"Platform bahut ganda hai, safai nahi hoti hai. Yeh bahut kharab hai.",platform bahut ganda safai nahi bahut kharab,186
MORLY/E/2023/3456789,"Train staff rude hai, unse baat karne mein bahut mushkil hoti hai.",train staff rude unse baat bahut mushkil,658
MORLY/E/2023/4567890,Ek baar phir se train late hui. Iska kuch karo bhai!,baar phir train late bhai,678
MORLY/E/2023/5678901,Mujhe ticket cancel karne ke baad paise nahi mile. Yeh bahut galat hai!,ticket cancel baad paise nahi mile bahut galat,253
MORLY/E/2023/6789012,Station par ek hi toilet hai aur vo bhi bahut ganda hai. Bahut dikkat hai.,station toilet bahut ganda bahut dikkat,318
