registration_no,subject_content_text,cleaned_text,agg_cluster
MORLY/E/2023/1098765,Payment karne mein dikkat aa rahi hai. Koi solution bataiye.,payment dikkat solution bataiye,611
MORLY/E/2023/0987654,Mujhe apne train ke schedule ke baare mein pata nahi chal raha hai.,apne train schedule baare pata nahi chal,360
MORLY/E/2023/7654328,Railway station par cleaning nahi hoti hai. Bahut ganda hai wahan.,railway station cleaning nahi bahut ganda wahan,1503
MORLY/E/2023/6543219,Staff ki service itni achhi nahi hai. Unhe training ki zarurat hai.,staff service itni achhi nahi training zarurat,125
MORLY/E/2023/5432108,Payment karne par successful nahi ho raha. Kya karun?,payment successful nahi karun,1025
MORLY/E/2023/2109875,"Train ka delay ho raha hai, iski wajah kya hai?",train delay iski wajah,335
MORLY/E/2023/1098764,Station ki cleaning aur maintenance bahut kharab hai.,station cleaning maintenance bahut kharab,364
MORLY/E/2023/4321097,"Staff ka behavior theek nahi hai, unhe training ki zarurat hai.",staff behavior theek nahi training zarurat,452
MORLY/E/2023/2109874,Payment nahi ho rahi hai. Kya issue hai? Help karein.,payment nahi issue,541
MORLY/E/2023/1098763,Mujhe train ke operation ke baare mein jaanne ki zarurat hai. Delay kyun ho raha hai?,train operation baare jaanne zarurat delay,632
MORLY/E/2023/2109873,Kanpur station par facilities bahut kharab hain. Sudhar ki zarurat hai.,kanpur station facilities bahut kharab sudhar zarurat,511
MORLY/E/2023/3210986,Staff se service bahut kharab hai. Unhe training ki zarurat hai.,staff service bahut kharab training zarurat,164
MORLY/E/2023/1234567,Railway station pe toilets bahut gande hain. Kripya ispar kuch karein.,railway station toilets bahut gande kripya ispar,744
MORLY/E/2023/7654321,"Train ki timing hamesha late hoti hai, staff ko iski training deni chahiye.",train timing hamesha late staff iski training deni chahiye,2033
MORLY/E/2023/2345678,"Mera ticket ka payment nahi hua, par paisa bank se deduct ho gaya. Help karein.",ticket payment nahi paisa bank deduct,1430
MORLY/E/2023/3456789,"Train staff ka behavior bahut kharab hai, customer se rude hote hain.",train staff behavior bahut kharab customer rude,355
MORLY/E/2023/4567890,"Platform ki safai bahut kharab hai, yeh bahut zaroori hai.",platform safai bahut kharab bahut zaroori,374
MORLY/E/2023/5678901,"Train ka coach bahut ganda tha, ispar kuch karna chahiye.",train coach bahut ganda ispar chahiye,85
MORLY/E/2023/6789012,"Mera PNR XXXXXX confirm nahi ho raha, paisa nahi wapas mila.",pnr xxxxxx confirm nahi paisa nahi wapas mila,243
MORLY/E/2023/7890123,"Railway staff ka behavior theek nahi hai, unko training deni chahiye.",railway staff behavior theek nahi unko training deni chahiye,615
MORLY/E/2023/8901234,"Station pe lift kharab hai, bada samasya hai. Iska turant hal chahiye.",station lift kharab bada samasya turant hal chahiye,75
MORLY/E/2023/9012345,"Train ki frequency bahut kam hai, ispar kuch karna chahiye. Bahut dikkat hoti hai.",train frequency bahut kam ispar chahiye bahut dikkat,424
MORLY/E/2023/1234568,"Mujhe refund nahi mila, paisa bank me hi hai. Kripya help karein.",refund nahi mila paisa bank kripya,431
MORLY/E/2023/2345679,Staff hamesha late aate hain aur kaam nahi karte. Kripya dekhein.,staff hamesha late kaam nahi karte kripya dekhein,1838
MORLY/E/2023/3456780,"Platform pe chhatri ka construction khatam nahi hua, baarish me samasya hoti hai.",platform chhatri construction khatam nahi baarish samasya,296
MORLY/E/2023/4567891,"Train ka schedule bahut hi khaas hona chahiye, sabko pata nahi chalta.",train schedule bahut khaas chahiye sabko pata nahi chalta,525
MORLY/E/2023/5678902,Mera account number XXXXXX se paisa nahi aa raha. Jaldi dekhein.,account number xxxxxx paisa nahi jaldi dekhein,6
MORLY/E/2023/6789013,Railway staff ka attitude kabhi kabhi achha nahi hota. Isko sudharna chahiye.,railway staff attitude achha nahi isko sudharna chahiye,379
MORLY/E/2023/7890124,"Station ka infrastructure kharab hai, baarish mein paani bharta hai.",station infrastructure kharab baarish paani bharta,414
MORLY/E/2023/8901235,"Train ki safety measures behtar hona chahiye, samasya hai.",train safety measures behtar chahiye samasya,1501
MORLY/E/2023/9012346,"Mera account number XXXXXX ke liye balance nahi dikh raha, jaldi dekhein.",account number xxxxxx balance nahi dikh jaldi dekhein,6
MORLY/E/2023/1234567,Railway station ki cleanliness bahut kharab hai. Kahi bhi kachra pada hai. Kripya sudharo.,railway station cleanliness bahut kharab kahi kachra pada kripya sudharo,638
MORLY/E/2023/2345678,"Train ka schedule baar baar badal raha hai, is wajah se mushkil ho raha hai travel karna.",train schedule baar baar badal wajah mushkil travel,399
MORLY/E/2023/3456789,Mujhe ticket book karte waqt payment nahi ho raha hai. Bahut baar koshish ki hai.,ticket book karte waqt payment nahi bahut baar koshish,9
MORLY/E/2023/4567890,"Railway staff ka behavior bahut rude hai, unhe training ki zarurat hai.",railway staff behavior bahut rude training zarurat,447
MORLY/E/2023/5678901,"Platform par koi benches nahi hain, logo ko baithe ka muskil ho raha hai.",platform benches nahi logo baithe muskil,1155
MORLY/E/2023/6789012,"Train ka time table aksar late ho raha hai, is wajah se pareshani ho rahi hai.",train time table aksar late wajah pareshani,1847
MORLY/E/2023/7890123,"Mujhe refund nahi mila hai, maine 2 mahine pehle cancel kiya tha.",refund nahi mila mahine pehle cancel,499
MORLY/E/2023/8901234,"Railway staff ki training bahut zaruri hai, unka behavior behtar hona chahiye.",railway staff training bahut zaruri behavior behtar chahiye,686
MORLY/E/2023/9012345,"Station par lift ka kaam nahi kar raha hai, badi samasya ho rahi hai.",station lift kaam nahi badi samasya,829
MORLY/E/2023/0123456,"Train mein bahut zyada delay ho raha hai, kuch nahi pata chalta.",train bahut zyada delay nahi pata chalta,529
MORLY/E/2023/1234568,Refund process mein bahut der ho rahi hai. Kya ho raha hai?,refund process bahut der,876
MORLY/E/2023/2345679,Railway ke staff ka behaviour baithak ke dauran acha nahi tha.,railway staff behaviour baithak dauran acha nahi,82
MORLY/E/2023/3456780,"Station par koi waiting area nahi hai, logo ko khade rehna pad raha hai.",station waiting area nahi logo khade rehna pad,505
MORLY/E/2023/4567891,"Train ka punctuality bahut kharab hai, bahut der se aati hai.",train punctuality bahut kharab bahut der aati,793
MORLY/E/2023/5678902,"Online ticket booking mein payment nahi ho raha, bahut baar try kiya.",online ticket booking payment nahi bahut baar try,771
MORLY/E/2023/6789013,"Train mein staff ka behavior theek nahi tha, unhe training ki zarurat hai.",train staff behavior theek nahi training zarurat,452
MORLY/E/2023/7890124,"Station par benches nahi hain, baithe hone ki jagah nahi hai.",station benches nahi baithe hone jagah nahi,556
MORLY/E/2023/8901235,"Train ka service bahut bekar hai, samay par nahi aati hai.",train service bahut bekar samay nahi aati,349
MORLY/E/2023/9012346,"Mujhe payment karte waqt dhokha mila hai, maine paisa nahi paya.",payment karte waqt dhokha mila paisa nahi paya,1048
MORLY/E/2023/9876543,Station ke toilets bahut gande hain. Inka maintenance theek se nahi ho raha hai. Kripya dhyan dein.,station toilets bahut gande inka maintenance theek nahi kripya dhyan dein,171
MORLY/E/2023/8765432,"Mere ticket ka paisa refund nahi hua. PNR XXXXXX hai, kripya dekhein.",ticket paisa refund nahi pnr xxxxxx kripya dekhein,846
MORLY/E/2023/7654321,"Train bahut late ho rahi hai, koi update nahi mil raha. Sabko pareshaan kar rahi hai.",train bahut late update nahi mil sabko pareshaan,679
MORLY/E/2023/6543210,"Platform par paani bhara hua hai, chhalang lagana padta hai. Iski sudhar ki zarurat hai.",platform paani bhara chhalang lagana padta iski sudhar zarurat,310
MORLY/E/2023/5432109,"Railyard mein staff ki kami hai, kaam sahi nahi ho raha. Kripya is par dhyan dein.",railyard staff kami kaam sahi nahi kripya dhyan dein,969
MORLY/E/2023/4321098,"Meri train ka schedule change ho gaya, mujhe pata nahi. Bahut pareshaan hua.",train schedule change pata nahi bahut pareshaan,691
MORLY/E/2023/3210987,"Ticket booking mein paise ka issue aaya, mujhe samajh nahi aa raha.",ticket booking paise issue samajh nahi,1367
MORLY/E/2023/2109876,"Railway station mein parking ki bahut kami hai, bhai logon ko dikkat ho rahi hai.",railway station parking bahut kami bhai logon dikkat,1902
MORLY/E/2023/1098765,"Train ke staff ka behavior achha nahi hai, kripya is par dhyan dein.",train staff behavior achha nahi kripya dhyan dein,969
MORLY/E/2023/0987654,"Meri train baar baar cancel ho rahi hai, samasya bahut badh rahi hai.",train baar baar cancel samasya bahut badh,429
MORLY/E/2023/7654321,"Mujhe refund nahi mila, PNR XXXXXX hai, jaldi dekhein.",refund nahi mila pnr xxxxxx jaldi dekhein,597
MORLY/E/2023/6543210,"Station par lift kaam nahi kar raha, kaafi museebat ho rahi hai.",station lift kaam nahi museebat,489
MORLY/E/2023/5432109,"Train ke ticket collector ne achha vyavhar nahi kiya, is par kadam uthayein.",train ticket collector achha vyavhar nahi kadam uthayein,768
MORLY/E/2023/2109876,"Train ka delay bahut badh gaya hai, kisi ko pata nahi kyun.",train delay bahut badh kisi pata nahi,244
MORLY/E/2023/1098765,"Mera online booking ka paisa wapas nahi aaya, PNR XXXXXX hai, check karein.",online booking paisa wapas nahi pnr xxxxxx check,1989
MORLY/E/2023/0987654,"Railway station mein waiting room kaafi dirty hai, safai ki zarurat hai.",railway station waiting room dirty safai zarurat,1270
MORLY/E/2023/3210987,"Ticket collector ne mera ticket check kiya aur paise nahi diye, yah galat hai.",ticket collector ticket check paise nahi yah galat,1188
MORLY/E/2023/2109876,"Train mein baithe waqt koi bhi announcement nahi ho raha hai, bhut samasya ho rahi hai.",train baithe waqt announcement nahi bhut samasya,225
MORLY/E/2023/1098765,"Booking ke samay mujhe kuch nahi pata chala, mera paisa wapas nahi aaya.",booking samay nahi pata chala paisa wapas nahi,1328
MORLY/E/2023/6543210,"Station par koi bhi signboard nahi hai, logon ko dikkat ho rahi hai.",station signboard nahi logon dikkat,937
MORLY/E/2023/7654321,"Train ka staff samasya ko nahi samajh raha hai, please madad karein.",train staff samasya nahi samajh,397
MORLY/E/2023/6543210,"Train ka schedule bilkul galat hai, baar baar delay ho raha hai. Isko thik karo.",train schedule galat baar baar delay isko thik,1013
MORLY/E/2023/7654321,"Mujhe payment karne mein problem ho rahi hai, baar baar transaction fail ho raha hai.",payment problem baar baar transaction fail,847
MORLY/E/2023/8765432,"Station par staff bahut rude hain, unse baat karna mushkil hota hai.",station staff bahut rude unse baat mushkil,398
MORLY/E/2023/9876543,"Platform par bahut gandh hai, safai thik nahi hai. Iska kuch karein.",platform bahut gandh safai thik nahi,191
MORLY/E/2023/1234560,"Mere train ka timing bar-bar change hota hai, mujhe samay par pahunchna hai.",train timing barbar change samay pahunchna,1019
MORLY/E/2023/2345678,"Transaction ke liye card nahi chal raha, main kya karun?",transaction card nahi chal main karun,1656
MORLY/E/2023/3456789,"Station par staff ko training ki zarurat hai, unse baatein karna mushkil hota hai.",station staff training zarurat unse baatein mushkil,596
MORLY/E/2023/4567890,"Station par toilet ki safai nahi ho rahi, bahut ganda hai.",station toilet safai nahi bahut ganda,318
MORLY/E/2023/5678901,"Train ki cleaning bahut bekar hai, safai par dhyan do.",train cleaning bahut bekar safai dhyan,627
MORLY/E/2023/6789012,"Mujhe payment ke liye baar baar error aa raha hai, madad karo.",payment baar baar error,954
MORLY/E/2023/7654322,Staff ko apne kaam ke liye aur training ki zarurat hai.,staff apne kaam training zarurat,634
MORLY/E/2023/8765433,"Railway station par parking sahi nahi hai, samasya hai.",railway station parking sahi nahi samasya,510
MORLY/E/2023/9876544,"Train ka time nahi hai, mujhe bahut problem ho rahi hai.",train time nahi bahut problem,234
MORLY/E/2023/1234569,"Mujhe payment nahi ho rahi hai, baar baar error aa raha hai.",payment nahi baar baar error,773
MORLY/E/2023/2345670,"Station par kaam kar raha staff bahut laaparwah hai, isko theek karo.",station kaam staff bahut laaparwah isko theek,1645
MORLY/E/2023/3456781,"Station par gaddhe hain, bade bade gaddhe hain, ye mat chhodo.",station gaddhe bade bade gaddhe mat chhodo,1116
MORLY/E/2023/4567892,"Train ka bahut late hona, mujhe samay par nahi pahunchna hai.",train bahut late samay nahi pahunchna,1036
MORLY/E/2023/6789014,"Payment ke liye baar-baar issue aa raha hai, kuch karo.",payment baarbaar issue,2007
MORLY/E/2023/5678901,"Train ka schedule hamesha late hota hai. Aaj bhi 2 ghante late hai, please kuch kijiye.",train schedule hamesha late aaj ghante late kijiye,165
MORLY/E/2023/1234568,Mujhe mera ticket refund nahi mila. Kya ho raha hai? Kripya madad karein.,ticket refund nahi mila kripya,1195
MORLY/E/2023/2345670,Station par staff ki kami hai. Kisi ne madad nahi ki jab mujhe zarurat thi.,station staff kami kisi nahi jab zarurat,377
MORLY/E/2023/3456781,"Platform bahut kharab hai, safai nahi hoti aur chhalne ka darr hai. Kya aap kuch kar sakte hain?",platform bahut kharab safai nahi chhalne darr sakte,962
MORLY/E/2023/4567892,Train ka time bilkul nahi pata chalta. Kahi par information nahi hai. Kya kuch kar sakte hain?,train time nahi pata chalta kahi information nahi sakte,628
MORLY/E/2023/5678903,Mera online payment fail gaya aur paisa nahi wapas hua. Kya ho raha hai?,online payment fail paisa nahi wapas,804
MORLY/E/2023/6789014,Station par staff se baat karne mein dikkat hoti hai. Vo log rude hote hain.,station staff baat dikkat log rude,857
MORLY/E/2023/7890125,"Platform par bahut gande hain, khud hi safai karna pad raha hai. Is par kuch karein.",platform bahut gande khud safai pad,1970
MORLY/E/2023/8901236,Train ke timings ke baare mein koi clarity nahi hai. Please ispar kuch kijiye.,train timings baare clarity nahi ispar kijiye,1613
MORLY/E/2023/9012347,Mera ticket ka payment process nahi ho raha hai. Bahut takleef ho rahi hai.,ticket payment process nahi bahut takleef,938
MORLY/E/2023/0123459,"Station par staff se samajh nahi aata, vo log madad nahi karte. Kya yeh theek hai?",station staff samajh nahi aata log nahi karte theek,152
MORLY/E/2023/1234560,"Station par toilets bahut gande hain, unki safai nahi hoti. Kya aap kuch kar sakte hain?",station toilets bahut gande unki safai nahi sakte,744
MORLY/E/2023/2345671,Train ki frequency bahut kam hai. Bahut samay lag raha hai. Ispar kuch kijiye.,train frequency bahut kam bahut samay lag ispar kijiye,424
MORLY/E/2023/3456782,Mera payment nahi hua hai. Kya mujhe kuch aur karna padega? Bahut pareshaan hoon.,payment nahi padega bahut pareshaan,1892
MORLY/E/2023/4567893,Staff logon ka behavior bilkul theek nahi hai. Koi madad nahi karta.,staff logon behavior theek nahi nahi karta,557
MORLY/E/2023/5678904,"Toilets ki safai bahut kharab hai, mujhe yahan aane mein takleef hoti hai, please kuch kijiye.",toilets safai bahut kharab yahan aane takleef kijiye,1515
MORLY/E/2023/6789015,"Train ki service kaafi bekar hai, bahut samay lagta hai aur koi information nahi milti.",train service bekar bahut samay lagta information nahi milti,78
MORLY/E/2023/7890126,Mera payment pending hai aur koi response nahi aa raha. Bahut pareshaan hoon.,payment pending response nahi bahut pareshaan,1713
MORLY/E/2023/2345678,Train ka timing hamesha late hota hai. Pichle mahine toh train 3 ghante late aayi thi.,train timing hamesha late pichle mahine train ghante late,1735
MORLY/E/2023/3456789,"Mujhe ticket ke liye pay kiya tha, par paisa abhi tak nahi wapas aaya. PNR XXXXXX.",ticket pay paisa abhi nahi wapas pnr xxxxxx,243
MORLY/E/2023/4567890,Platform bahut ganda hai aur safety issues hain. Is par dhyan dena chahiye.,platform bahut ganda safety issues dhyan dena chahiye,1068
MORLY/E/2023/5678901,"Jo railway staff hai, wo customers se baat karne mein rude hain. Ispar kuch karna chahiye.",railway staff customers baat rude ispar chahiye,908
MORLY/E/2023/6789012,"Train ka service bahut bekar hai, main baar baar complain kar raha hoon, lekin kuch nahi ho raha.",train service bahut bekar main baar baar complain nahi,662
MORLY/E/2023/7890123,"Mera ticket cancel ho gaya tha, lekin refund nahi aaya. Kya kuch kar sakte hain?",ticket cancel refund nahi sakte,136
MORLY/E/2023/8901234,"Station ki infrastructure itni purani ho gayi hai, kuch karna chahiye.",station infrastructure itni purani chahiye,987
MORLY/E/2023/9012345,"Ek staff member ne mujhe rude bola. Yeh nahi hona chahiye, customer service pe dhyan dena chahiye.",staff member rude bola nahi chahiye customer service dhyan dena chahiye,1027
MORLY/E/2023/0123456,Train ka coach clean nahi tha aur bahut bekar tha. Yeh sab aur achha hona chahiye.,train coach clean nahi bahut bekar achha chahiye,1508
MORLY/E/2023/1234567,"Mera PNR XXXXXX hai, par mujhe refund nahi mila. Kya iska kuch samadhan hai?",pnr xxxxxx refund nahi mila samadhan,830
MORLY/E/2023/2345679,"Railway station ki cleaning aur facilities bahut bekar hain, kuch karna chahiye.",railway station cleaning facilities bahut bekar chahiye,367
MORLY/E/2023/3456780,Staff ka behavior thoda rude hai. Is par kuch karna chahiye.,staff behavior thoda rude chahiye,504
MORLY/E/2023/4567891,Train ki seats reserve karne mein problem aa raha hai. Kuch karna padega.,train seats reserve problem padega,11
MORLY/E/2023/5678902,Mujhe payment issue aa raha hai. Kya iska kuch solution hai?,payment issue solution,416
MORLY/E/2023/6789013,Railway station par facilities kaafi kam hain. Is par dhyan dena chahiye.,railway station facilities kam dhyan dena chahiye,217
MORLY/E/2023/7890124,Maine dekha hai ki staff customer ko jaane nahi dete. Is par dhyan hona chahiye.,dekha staff customer jaane nahi dete dhyan chahiye,1435
MORLY/E/2023/8901235,"Train ki frequency bahut kam hai, is par kuch karna chahiye.",train frequency bahut kam chahiye,424
MORLY/E/2023/9012346,Maine ticket book kiya par payment nahi ho raha. Kya kuch kiya ja sakta hai?,ticket book payment nahi sakta,734
MORLY/E/2023/7654321,"Train baar baar late hoti hai aur kabhi kabhi to train chhutti hai, yaar ye kya hai?",train baar baar late train chhutti yaar,206
MORLY/E/2023/8765432,"Mere refund ka paisa ab tak nahi aaya hai, please jaldi karein!",refund paisa nahi jaldi,138
MORLY/E/2023/9876543,"Train ke staff ka behavior bahut kharab hai, sabko rude hain.",train staff behavior bahut kharab sabko rude,355
MORLY/E/2023/6543210,"Railway station ki safai bahut kharab hai, kaam karna chahiye.",railway station safai bahut kharab kaam chahiye,1062
MORLY/E/2023/5432109,"Mujhe apne ticket ka PNR ka status nahi mil raha hai, wo kya hai?",apne ticket pnr status nahi mil,188
MORLY/E/2023/2109876,"Mujhe do baar payment karna pada, ek baar refund nahi aaya.",baar payment pada baar refund nahi,1261
MORLY/E/2023/3210987,Conductor ne mujhe ticket nahi diya. Yeh bahut galat hai!,conductor ticket nahi bahut galat,196
MORLY/E/2023/4567890,"Station par washroom bahut ganda hai, safai karwaiye.",station washroom bahut ganda safai karwaiye,621
MORLY/E/2023/5678901,"Meri train ki timing baar baar change hoti hai, samasya kya hai?",train timing baar baar change samasya,279
MORLY/E/2023/8901234,"Mujhe ticket book karne par paise nahi mile, yeh kya hai?",ticket book paise nahi mile,253
MORLY/E/2023/0123456,"Train ka staff bahut rude hai, bahut gussa aata hai.",train staff bahut rude bahut gussa aata,500
MORLY/E/2023/3456789,"Train ke platform par bhoot se badi samasya hai, bahut gandi hai. Sudhar karein.",train platform bhoot badi samasya bahut gandi sudhar,1969
MORLY/E/2023/4567891,"Kuch trains ko cancel kiya gaya hai bina kisi wajah ke, yeh bilkul galat hai.",trains cancel bina kisi wajah galat,1039
MORLY/E/2023/5678902,"Mujhe refund nahi mila, sab kuch theek kiya tha. Help karein.",refund nahi mila theek,431
MORLY/E/2023/6789013,"Train ke staff ki training nahi hui hai, unhe samajhna chahiye.",train staff training nahi samajhna chahiye,35
MORLY/E/2023/7890123,"Station par ek lift kharab hai, bahut mushkil hoti hai chadhne mein.",station lift kharab bahut mushkil chadhne,75
MORLY/E/2023/8901235,Train ki timing samasya kab suljhaegi? Bahut dikkat ho rahi hai.,train timing samasya suljhaegi bahut dikkat,745
MORLY/E/2023/1234567,Mujhe payment receive nahi hua. Please madad karein.,payment receive nahi,1679
MORLY/E/2023/7890124,"Mujhe staff se bahut problem hui, unse baat karni mujhe pasand nahi hai.",staff bahut problem unse baat karni pasand nahi,1285
MORLY/E/2023/3456780,"Station ke bahar badi gandi hai, bahut dikkat hoti hai, please clean karein.",station bahar badi gandi bahut dikkat clean,651
MORLY/E/2023/5678903,"Train ki frequency bahut kam hai, kya aap isko badha sakte hain?",train frequency bahut kam isko badha sakte,424
MORLY/E/2023/6789012,"Mera payment ab tak nahi aaya hai, please jaldi karein.",payment nahi jaldi,680
MORLY/E/2023/7890125,"Staff se koi madad nahi mil rahi, sab log busy hain.",staff nahi mil log busy,729
MORLY/E/2023/8901237,"Jodhpur station par platform bahut kharab hai, sudhar karein.",jodhpur station platform bahut kharab sudhar,625
MORLY/E/2023/3456781,"Train ka performance accha nahi hai, thoda behtar kariye.",train performance accha nahi thoda behtar kariye,1186
MORLY/E/2023/2345678,"Platform pe safai nahi hoti hai, bhut ganda lagta hai.",platform safai nahi bhut ganda lagta,450
MORLY/E/2023/3456789,"Mera ticket ka paisa refund nahi hua hai, please help.",ticket paisa refund nahi,791
MORLY/E/2023/4567890,"Train timing sahi nahi hai, delay hota hai baar baar.",train timing sahi nahi delay baar baar,1785
MORLY/E/2023/5678901,"Staff ka behavior acha nahi hai, rude bolte hain.",staff behavior acha nahi rude bolte,65
MORLY/E/2023/6789012,"Station ki building dikkat de rahi hai, kuch karna padega.",station building dikkat padega,816
MORLY/E/2023/7890123,Mere account se paise ghote hain bina kisi reason ke.,account paise ghote bina kisi reason,1281
MORLY/E/2023/8901234,Trains baar baar cancel ho rahi hain. Kya hota hai?,trains baar baar cancel,429
MORLY/E/2023/9012345,"Train mein staff ka behavior samasya hai, unse baat nahi hoti.",train staff behavior samasya unse baat nahi,1052
MORLY/E/2023/0123456,"Railway stations par basic facilities nahi hain, bahut mushkil hota hai.",railway stations basic facilities nahi bahut mushkil,93
MORLY/E/2023/1234567,"Ticket booking mein payment issue aa raha hai, please help.",ticket booking payment issue,820
MORLY/E/2023/2345679,"Train ka schedule kabhi kabhi sahi nahi hota, kuch karna padega.",train schedule sahi nahi padega,180
MORLY/E/2023/3456780,"Train staff kabhi kabhi samasya dete hain, unhe sudharna padega.",train staff samasya dete sudharna padega,1072
MORLY/E/2023/4567891,"Station ki cleanliness bahut kharab hai, kuch nahi hota yahan.",station cleanliness bahut kharab nahi yahan,362
MORLY/E/2023/5678902,"Mera refund nahi aa raha, kya problem hai?",refund nahi problem,394
MORLY/E/2023/6789013,"Train ke operation mein kai baar dikkat hoti hai, kuch nahi hota.",train operation kai baar dikkat nahi,1536
MORLY/E/2023/7890124,"Railway staff ka behavior theek nahi hai, sudhar karna padega.",railway staff behavior theek nahi sudhar padega,1199
MORLY/E/2023/8901235,"Station ki infrastructure bahut purani hai, badalna padega.",station infrastructure bahut purani badalna padega,1799
MORLY/E/2023/9012346,"Refund ka process kuch samasya dikha raha hai, please assist.",refund process samasya dikha assist,69
MORLY/E/2023/0123457,"Train ka delay baar baar hota hai, bhut parishani hoti hai.",train delay baar baar bhut parishani,1189
MORLY/E/2023/1234568,"Staff ka behavior acha nahi hai, kuch karna padega.",staff behavior acha nahi padega,65
MORLY/E/2023/2345670,"Station par facilities bilkul nahi hain, zaroori hai sudharna.",station facilities nahi zaroori sudharna,1282
MORLY/E/2023/3456781,"Mera payment ab tak nahi aaya, kya issue hai?",payment nahi issue,541
MORLY/E/2023/1234567,"Mujhe train ka time change hone ki information nahi mili, is wajah se problem hui.",train time change hone information nahi mili wajah problem,144
MORLY/E/2023/2345678,"Mujhe ticket ke liye ki gayi payment ka confirmation nahi mila, bahut pareshaan hoon.",ticket payment confirmation nahi mila bahut pareshaan,270
MORLY/E/2023/3456789,"Platform par safai nahi ho rahi hai, bahut ganda ho gaya hai.",platform safai nahi bahut ganda,375
MORLY/E/2023/4567890,"Railway ke staff ne mujhe bura bhala kaha, unki training nahi hui kya?",railway staff bura bhala kaha unki training nahi,321
MORLY/E/2023/5678901,"Train mein kaafi der ho gayi, koi information nahi di gayi.",train der information nahi,444
MORLY/E/2023/6789012,"Mainne ticket cancel kiya tha par refund nahi mila, samasya hai.",mainne ticket cancel refund nahi mila samasya,1114
MORLY/E/2023/7890123,"Station ke washroom bahut gande hain, safai nahi ho rahi hai.",station washroom bahut gande safai nahi,342
MORLY/E/2023/8901234,"Railway personnel ne mujhe rude behavior dikhaya, bahut bura laga.",railway personnel rude behavior dikhaya bahut bura laga,228
MORLY/E/2023/9012345,"Train ki timing barabar nahi hai, bar bar der hoti hai.",train timing barabar nahi bar bar der,803
MORLY/E/2023/0123456,"Maine dus baar payment kiya par ticket nahi mila, kya karun?",dus baar payment ticket nahi mila karun,751
MORLY/E/2023/1234568,"Station par lift kaam nahi kar raha, bahut dikkat ho rahi hai.",station lift kaam nahi bahut dikkat,489
MORLY/E/2023/2345679,"Staff ne meri madad nahi ki jab mujhe zarurat thi, bahut naraz hoon.",staff nahi jab zarurat bahut naraz,1178
MORLY/E/2023/3456780,"Train mein khana nahi tha aur bahut der ho gayi, sab kuch khatam ho gaya.",train khana nahi bahut der khatam,784
MORLY/E/2023/4567891,"Mainne ticket book kiya tha par amount nahi deduct hua, kya problem hai?",mainne ticket book amount nahi deduct problem,1925
